ID;Tweet;Dimension;Intensity;Description
2018-Es-01686;estoy a nada de ponerme a llorar en el pasillo de desodorantes y shampoo;valence;-3;se infiere un estado emocional muy negativo
2018-Es-04369;cami: a veces pienso que eres tímida pero recuerda que puedes hacer las locuras que tú quieras sin importar lo que digan, te adoro;valence;0;se infiere un estado emocional neutral or mixto
2018-Es-04271;Nos pusimos a guliar fiambre con las pibas y mayo ;valence;0;se infiere un estado emocional neutral or mixto
2018-Es-03939;Aqui viendo la guerra de memes -los guarda-  ;valence;0;se infiere un estado emocional neutral or mixto
2018-Es-00513;@alejandromesias Justo eso quiero evitar... la tristeza!;valence;-2;se infiere un estado emocional moderadamente negativo
2018-Es-04176;#GÉMINIS: a veces piensas como ejecutar una buena venganza contra los que han sido malos contigo. Tarde o temprano la llevarás a cabo...;valence;-2;se infiere un estado emocional moderadamente negativo
2018-Es-06132;#Maracaibo me huele a peligro. Alguien sabe porque los comando de la GNB están vacíos? Y muchos saqueados.;valence;-1;se infiere un estado emocional ligeramente negativo
2018-Es-00095;"@iharting @Jullietbanda ""infeliz"" no es la palabra que mejor se adapta pero usted es una persona educada.";valence;0;se infiere un estado emocional neutral or mixto
2018-Es-02963;@SoyNovioDeTodas @MayraJiraaSCF Querer darte una sorpresa y que salga mal 😂;valence;0;se infiere un estado emocional neutral or mixto
2018-Es-03470;Y fui tan afortunada de tener la dicha de tener un súper abuelito como tú.;valence;3;se infiere un estado emocional muy positivo
2018-Es-04814;@Rodrigo38740672 jajaja 28 decís? ;valence;2;se infiere un estado emocional moderadamente positivo
2018-Es-03170;Amigos que están aún no estén  RT @Rhoderis: Hay gente que a pesar de todo, no te dejan de querer;valence;1;se infiere un estado emocional ligeramente positivo
2018-Es-05197;Mi relacion con yerko es un cague de risa;valence;1;se infiere un estado emocional ligeramente positivo
2018-Es-05227;@YamelPO97 A mi me estresan pdl pero no puedo dejar de verlos ;valence;-1;se infiere un estado emocional ligeramente negativo
2018-Es-01208;@Nescafe_ES Por favor nunca me toca nada más que enfermedades una alegría no vendría mal aunque fuera pequeña;valence;-2;se infiere un estado emocional moderadamente negativo
2018-Es-03745;Que felicidad parce 😭😭 #JuanPabloJaramillo #XtiianZechTrendy #KCAMexico;valence;1;se infiere un estado emocional ligeramente positivo
2018-Es-03837;Viste cuando tenes un novio super celoso ;valence;-1;se infiere un estado emocional ligeramente negativo
2018-Es-01586;Qp con la morra esta quien se cree ? ;valence;-2;se infiere un estado emocional moderadamente negativo
2018-Es-05712;Quiero café, pero el café de tus ojos, del claro, porque ese oscuro me da dolor de cabeza...;valence;0;se infiere un estado emocional neutral or mixto
2018-Es-01998;"Lo bueno, respecto a mi Husky y luego de ver ""todos los perritos se van al cielo"" y ""el propósito de un perro"", guardo alegría y esperanza.";valence;1;se infiere un estado emocional ligeramente positivo
2018-Es-05604;@Valeriatulip para que causan escalofríos  mas de uno salió a ponerse un suéter 😂;valence;0;se infiere un estado emocional neutral or mixto
2018-Es-04404;Esa pelea del 26 de Agosto se presta demasiado!!;valence;-1;se infiere un estado emocional ligeramente negativo
2018-Es-01261;Kimberly, si me lee, perdió la apuesta que un día hicimos JAJAJAJAJAJAJAJAJAJA.;valence;1;se infiere un estado emocional ligeramente positivo
2018-Es-01447;@javo_naranja18 Nombre, con esos 2 tenemos. Lo de Mora no es tan grave y confío en que caute despierte esta temporada;valence;0;se infiere un estado emocional neutral or mixto
2018-Es-03729;Todo lo bueno tiene algo malo, si este mes está bien no quiero saber el mes que viene  ;valence;-2;se infiere un estado emocional moderadamente negativo
2018-Es-06752;@mariianCaste @charlitosb HAHAHAHA qué vivo el patojo... ya era hora ;valence;1;se infiere un estado emocional ligeramente positivo
2018-Es-01062;@haashoficial  por que ami  Me tiene que pasar esto 💔 Quiero gritar que ya basta 😿 Quiero abrazarlas pero nunca podré Dios mío 😷😭  #triste;valence;-3;se infiere un estado emocional muy negativo
2018-Es-01918;@Ricardo10y9 Te gusta como juega ALIANZA?;valence;1;se infiere un estado emocional ligeramente positivo
2018-Es-02606;De las derrotas salen los mejores versos. #Ironico;valence;1;se infiere un estado emocional ligeramente positivo
2018-Es-01369;@Sofilami Es que me la sacaron ;valence;-1;se infiere un estado emocional ligeramente negativo
2018-Es-05950;Mi mejor amiga se caso, mis amig@s con sus pitos y sus conchas me dejan de lado y bueno yo acá con mi gato que le hago un mimo y se va ;valence;-2;se infiere un estado emocional moderadamente negativo
2018-Es-06655;@JORGELAMRET @elgrajobajo Q se quema? Pues esos matorrales sin valor! #ironía;valence;-2;se infiere un estado emocional moderadamente negativo
2018-Es-03554;@clarymaffeis boluda en serio no sabias es como la primer cosa de la q te enterás cuando entras a la secundaria;valence;-2;se infiere un estado emocional moderadamente negativo
2018-Es-04583;Al que no ha visto, no le consta. Por ende no inventen chismes ;valence;-2;se infiere un estado emocional moderadamente negativo
2018-Es-03991;@Nalgonauta Jajajajajajaja jajaj esa foto debe ser medio desagradable;valence;0;se infiere un estado emocional neutral or mixto
2018-Es-05566;¡¡Feliz  día amigos hermanos que nos encontramos por este paso que se llama vida..¡¡;valence;3;se infiere un estado emocional muy positivo
2018-Es-06599;Escuchar musica triste y terminar mas triste que la música;valence;-3;se infiere un estado emocional muy negativo
2018-Es-04708;Asumo mis consecuencia y admito mis errores, esos que excusé, por nerviosismo, por temores.;valence;0;se infiere un estado emocional neutral or mixto
2018-Es-05991;15 días para inscribir materias y casi un mes para entrar de nuevo. Que está dicha tan hijueputa!;valence;-2;se infiere un estado emocional moderadamente negativo
2018-Es-03803;@vdevaldivia #ironía. Que hay gente que no entiende las cosas.;valence;-1;se infiere un estado emocional ligeramente negativo
2018-Es-05987;Quiero que esto solo sea una broma ;valence;-1;se infiere un estado emocional ligeramente negativo
2018-Es-03151;-provocar. Tengo que comentar algo al respecto???;valence;-1;se infiere un estado emocional ligeramente negativo
2018-Es-02088;@MiLagros_AJ Ya se me paso eso, soy celosa me enojo todo pero dsp se me pasa no me podria enojar mas d 10min con uds.;valence;0;se infiere un estado emocional neutral or mixto
2018-Es-01659;@cristobalsoria Perdona @MarkElExperto ¿puedes confirmarme que está 100% rabioso?;valence;-1;se infiere un estado emocional ligeramente negativo
2018-Es-06071;Estoy tan orgullosa de byron 💚;valence;2;se infiere un estado emocional moderadamente positivo
2018-Es-03845;Si vamos juntos no hay porque tener temor.;valence;0;se infiere un estado emocional neutral or mixto
2018-Es-05848;@clssypoetry Al carajo, te amo infinitamente. Soy afortunado de tenerte y saber que estas para mi. Siempre estaré a tu lado, mi niña.;valence;3;se infiere un estado emocional muy positivo
2018-Es-01221;Que tu primer dia no sea en el cumbres esta muy triste.;valence;-2;se infiere un estado emocional moderadamente negativo
2018-Es-01203;Tremendo estalcaso con mg incluido jaja;valence;1;se infiere un estado emocional ligeramente positivo
2018-Es-03294;Le tomo mucha importancia a las bandas que escuchó, porque sus canciones me han ayudado a salir en momentos de tristeza, me han motivado.;valence;0;se infiere un estado emocional neutral or mixto
2018-Es-05447;Qué tristeza sentir que uno no es suficiente para nada ni para nadie. Meh, matenme que ya ni yo me aguanto.;valence;-2;se infiere un estado emocional moderadamente negativo
2018-Es-05818;Cuando era chiquito queria ser Jimmy Neutron, y ahora voy a estudiar animacion.  ¿Dónde quedaron mis sueños? #nostalgia;valence;-2;se infiere un estado emocional moderadamente negativo
2018-Es-06405;Sonreír siempre ha sido más fácil que explicar por qué estás triste;valence;0;se infiere un estado emocional neutral or mixto
2018-Es-06172;@IsaCamargoSoto Siiiiiiii verdad mañana es festivo, me confundí;valence;3;se infiere un estado emocional muy positivo
2018-Es-06335;Jajajajaja pobre pendeja que se maneje,pedazo de resentida;valence;-2;se infiere un estado emocional moderadamente negativo
2018-Es-05141;@TAMARA_SUJU Este como que se fumo una lumpia o esta cansado;valence;-1;se infiere un estado emocional ligeramente negativo
2018-Es-04277;Aquí lo que importa eres tú #ironía??;valence;0;se infiere un estado emocional neutral or mixto
2018-Es-02526;@Miguelrs170 Ay enserio sii lo odiiiiiiio jajajajajaja, pero se ve bien nice ;valence;2;se infiere un estado emocional moderadamente positivo
2018-Es-05369;Quien te ama de verdad cuida tus  sentimientos y su prioridad es hacerte feliz 24/7.;valence;1;se infiere un estado emocional ligeramente positivo
2018-Es-01793;@Irene_Montero_ Es el dinero de todas y debe responder. Que indignación y q impotencia.;valence;-3;se infiere un estado emocional muy negativo
2018-Es-04595;Temblores,huracanes,el popo activo y ahora Sofía Niño de Rivera cancela su show? #CuantosMasEPN #FuerzaMexico #Sarcasmo 😒#ParaSerHonestosYo;valence;-3;se infiere un estado emocional muy negativo
2018-Es-05246;@NestorReverol Es lamentable tanto odio inoculado de la derecha fascistas! por eso NO VOLVERAN !;valence;-3;se infiere un estado emocional muy negativo
2018-Es-00151;No debe haber cosa mas linda que ver a la gente sonreír !!;valence;3;se infiere un estado emocional muy positivo
2018-Es-03523;Me acorde del momento de ayer e instantáneamente sonreí, enganchada? No, ni ahí ;valence;1;se infiere un estado emocional ligeramente positivo
2018-Es-03396;Después de quemar 3 iglesias, la Delegación del Gobierno y 5 Zaras...me voy a dormir! Que los catalanes hacemos cosas! #Hispanofobia #ironia;valence;-2;se infiere un estado emocional moderadamente negativo
2018-Es-05573;Millones de razones para sonreír & darle gracias a dios por todos ✨;valence;2;se infiere un estado emocional moderadamente positivo
2018-Es-00386;@its_fedra La neta yo me veo igual de feo llorando sea la situacion que sea, así que por eso siempre pregunto JAJAJJAA PERDÓN;valence;0;se infiere un estado emocional neutral or mixto
2018-Es-02233;@itsjoelpimentel ¡Estoy tan emocionada, mañana voy al concierto!🎉🙃;valence;3;se infiere un estado emocional muy positivo
2018-Es-04840;Y con este tuit intento ofender a varios grupúsculos at the very same time.;valence;-2;se infiere un estado emocional moderadamente negativo
2018-Es-00128;Este tweet esta deprimido por muchos recuerdos:(;valence;-3;se infiere un estado emocional muy negativo
2018-Es-05663;nunca puede faltar una gallina de la suerte en votaciones #CD9 #Coders #AlonsoVillalpandoTrendy #KCAMexico;valence;-1;se infiere un estado emocional ligeramente negativo
2018-Es-03628;Papi si me venis a buscar no me enojo;valence;0;se infiere un estado emocional neutral or mixto
2018-Es-05556;Odio ser tan sensible, me emociono muy rápido, me enojo muy rápido y me pongo mal el doble de rápido.;valence;-2;se infiere un estado emocional moderadamente negativo
2018-Es-01925;Muchos entre mas tienen mas ambicionan y los pies se les alejan de la tierra por que ya no les importa que les pase a los demas egoistas ;valence;-2;se infiere un estado emocional moderadamente negativo
2018-Es-05097;Mucha presencia policial en estación Constitución y aledaños desde ayer. ;valence;-1;se infiere un estado emocional ligeramente negativo
2018-Es-03340;Ubos pera ni ira 😭😭;valence;-2;se infiere un estado emocional moderadamente negativo
2018-Es-02395;Si esta bien que sean vacaciones PERO NO esta cool poner musica punchis punchis a todo volumen en miércoles para el deleite de tus vecinos✖️;valence;-1;se infiere un estado emocional ligeramente negativo
2018-Es-03101;@omarfdosk8 @CaracolTV @DesafioCaracol Andrea fea mala aburrida gafa odiosa estupida sisañera chismosa etc etc etc;valence;-3;se infiere un estado emocional muy negativo
2018-Es-01015;@Persefone95 antes de ver el que estoy viendo pase por dos primeros capitulos de dos doramas que iugh, hasta que vi ese que me gusto;valence;1;se infiere un estado emocional ligeramente positivo
2018-Es-05453;@Bamf_ Pues es mejor una siesta improvisada que un video que por cansancio improvisado quizá cueste hacer jaja;valence;0;se infiere un estado emocional neutral or mixto
2018-Es-05618;Asi cuando le dicen a la orquesta que estará el alcalde de Valencia y de Puerto Cabello..... ojoi ojoi ojoi! xD #Ironico;valence;0;se infiere un estado emocional neutral or mixto
2018-Es-03372;@moises32g Orale va se juega Pero no empiezas de gay;valence;0;se infiere un estado emocional neutral or mixto
2018-Es-01390;@fabianmendozav Y juega el @ABucaramanga .....;valence;0;se infiere un estado emocional neutral or mixto
2018-Es-03555;@JHopeMex 😍😍😍 Jin se coló ;valence;1;se infiere un estado emocional ligeramente positivo
2018-Es-01727;Me robas una sonrisa... cuando de mis ojos sólo salen lágrimas!! Te Quiero!! 😘😘❤;valence;3;se infiere un estado emocional muy positivo
2018-Es-04084;Cuando se vayan a montar en el carro no activen la alarma a distancia, hacerlo lo más cerca posible siempre viendo hacia todos lados.;valence;-2;se infiere un estado emocional moderadamente negativo
2018-Es-05923;@miledelval La dicha se repitita?;valence;-1;se infiere un estado emocional ligeramente negativo
2018-Es-05747;Un rey hablando de democracia...#ironía;valence;0;se infiere un estado emocional neutral or mixto
2018-Es-02077;La depresión te consume ue;valence;-3;se infiere un estado emocional muy negativo
2018-Es-04328;"Necesito personas que digan a todo ""si"" y no que salgan con ""peros"" ";valence;0;se infiere un estado emocional neutral or mixto
2018-Es-05045;"Mi mama: ""no no, no estoy enojada""  Yo: no se si te creo que no estoy enojada jajaja";valence;0;se infiere un estado emocional neutral or mixto
2018-Es-00060;@AndresParcerito Y yo de la limonada de limón ;valence;0;se infiere un estado emocional neutral or mixto
2018-Es-04291;@Armdocanchola JAJAJAJAJAJAJAJA no me refería a ese tipo de camino aún ;valence;1;se infiere un estado emocional ligeramente positivo
2018-Es-06191;Que me perdone mica pero yo lo voy a leer ;valence;-1;se infiere un estado emocional ligeramente negativo
2018-Es-01507;Me encanta que en los grupos manden audios de dos minutos, en serio, los oigo en cuanto me llegan #sarcasmo;valence;0;se infiere un estado emocional neutral or mixto
2018-Es-05541;@StoesselMyJoy FELIZ DÍAS MI AMORR;valence;3;se infiere un estado emocional muy positivo
2018-Es-05513;Los comentarios sobre España en Instagram son tan interesantes como leer La Razón #ironía;valence;-1;se infiere un estado emocional ligeramente negativo
2018-Es-04588;@RaulOlive @MexicoFER @jrisco Y quiza te critiqué, por tu obesidad mórbida y tu pésimo gusto. Ups #sarcasmo;valence;-3;se infiere un estado emocional muy negativo
2018-Es-03533;@Hil_dodoo mañana te dibujo sin falta, perdón por el atraso 😥;valence;-1;se infiere un estado emocional ligeramente negativo
2018-Es-03053;@saamuelperez este negro es muy gracioso se ve cool;valence;1;se infiere un estado emocional ligeramente positivo
2018-Es-03758;Tengo re abandonado el tw;valence;-1;se infiere un estado emocional ligeramente negativo
2018-Es-02648;...espero que con esto haya bajado 10 kilos 😂 #AyAjá #SeValeSoñar;valence;1;se infiere un estado emocional ligeramente positivo
2018-Es-06384;Lamentablemente soy muy sensible y cualquier tonteria me hace daño.;valence;-3;se infiere un estado emocional muy negativo
2018-Es-04460;cabros, sólo paso a contarles que estoy mas entretenido de lo que jamás hubiese pensado en estar hoy. Fin del comunicado.;valence;0;se infiere un estado emocional neutral or mixto
2018-Es-02744;@magnitudCL No me di ni cuenta ;valence;0;se infiere un estado emocional neutral or mixto
2018-Es-06380;el caso de silvya likens es tan horrible lpm;valence;-2;se infiere un estado emocional moderadamente negativo
2018-Es-03067;Le mandaría eso a Sofi pero no soy tan mala porque sé que de verdad le asusta las arañas ;valence;0;se infiere un estado emocional neutral or mixto
2018-Es-02887;Lamentablemente a la familia no se la puede escoger.;valence;-3;se infiere un estado emocional muy negativo
2018-Es-06770;@framsnunez_ De teh quiz teh quiz ;valence;0;se infiere un estado emocional neutral or mixto
2018-Es-05850;Qué horrible no poder confiar, sentir que te harán daño otra vez y no saber cómo huir sin mirar atrás!!;valence;-3;se infiere un estado emocional muy negativo
2018-Es-05719;o sea que hay una extraña que todas las noches le da la recena a mi gato y que se ha ofendido porque le hemos dicho que no se la de.;valence;-2;se infiere un estado emocional moderadamente negativo
2018-Es-05574;"Hoy en ""iria versus burocracia"" el caso del banco. Donde siempre ocurren cosas maravillosas... #ironía";valence;-1;se infiere un estado emocional ligeramente negativo
2018-Es-01293;@richarddigo No creo yo eso jajajajaja si conmigo estas amargado;valence;0;se infiere un estado emocional neutral or mixto
2018-Es-02841;Chongo usa mi cuenta de Netflix y sólo ve cosas de narcotráfico ;valence;-1;se infiere un estado emocional ligeramente negativo
2018-Es-01784;Si alguien quiere traer unas facturitas no me enojo... 😊;valence;0;se infiere un estado emocional neutral or mixto
2018-Es-02065;Jajajajajajajajaajjajajaajaj era peligrosa la tecnica;valence;3;se infiere un estado emocional muy positivo
2018-Es-02960;Ya se hizo de noche ;valence;-2;se infiere un estado emocional moderadamente negativo
2018-Es-01839;Me usaron de amuleto sin que yo sepa y central perdió 4-0 ;valence;-2;se infiere un estado emocional moderadamente negativo
2018-Es-04867;@haroldazuara Tira el miedo cuando vayas al baño ;valence;-1;se infiere un estado emocional ligeramente negativo
2018-Es-02145;Por la chucha ya empezaron las noches calurosas 😥;valence;-1;se infiere un estado emocional ligeramente negativo
2018-Es-00028;@clssypoetry Milena, tu personaje es hermosa, te queda muy bonita. Me gusta tu biografía y tu nombre. Pareces divertida y linda. —K;valence;1;se infiere un estado emocional ligeramente positivo
2018-Es-03437;@babyqueenm Jajajaja no manches ;valence;2;se infiere un estado emocional moderadamente positivo
2018-Es-03133;Sigo creyendo que soy la persona mas solitaria del mundo;valence;-3;se infiere un estado emocional muy negativo
2018-Es-00789;Joda cule rabia esa monda mk.;valence;-2;se infiere un estado emocional moderadamente negativo
2018-Es-06456;@luciamcias La vida esta enojada conmigo, yo soy feliz;valence;-2;se infiere un estado emocional moderadamente negativo
2018-Es-02810;Que hdp es😠;valence;-3;se infiere un estado emocional muy negativo
2018-Es-00619;Lihuel se hace el ofendido pero yo se que un poquitttttito me ama;valence;0;se infiere un estado emocional neutral or mixto
2018-Es-03110;@Dabeeche Aun queda Piccolo, aun hay esperanza ;valence;1;se infiere un estado emocional ligeramente positivo
2018-Es-02488;¿Los árbitros mandando a la verga al América en un partido? Vaya, que novedad. #Sarcasmo ¿Ahora cuál será la excusa pendeja de la comisión?;valence;-1;se infiere un estado emocional ligeramente negativo
2018-Es-05826;Recuerdo cuando todo meco decía que después de 11:30 ya era hora horny ;valence;0;se infiere un estado emocional neutral or mixto
2018-Es-01822;@DebRyanShow @AlexXxStrecci #rayito claro que si, un cambio es genial;valence;3;se infiere un estado emocional muy positivo
2018-Es-03511;curao d espanto,;valence;0;se infiere un estado emocional neutral or mixto
2018-Es-01950;Historias de un toledano enfurecido;valence;-3;se infiere un estado emocional muy negativo
2018-Es-03692;#sarcasmo ....Solo eso. ...;valence;-1;se infiere un estado emocional ligeramente negativo
2018-Es-05695;Llevo 3 o 4 días conectándome poquísimo y veo que lo estáis pasando genial. #Susto;valence;0;se infiere un estado emocional neutral or mixto
2018-Es-01941;Mañana empiezo la dieta porque quiero bajar un kilo, no menos, unos 5 ;valence;0;se infiere un estado emocional neutral or mixto
2018-Es-03329;@Daniel_ChefMX así que tómalo como algo psicológico, no de gordura ;valence;-1;se infiere un estado emocional ligeramente negativo
2018-Es-04259;@SolinkaArias Encantado de apoyarlos con @botaspuesta desde Chile 🇨🇱.;valence;2;se infiere un estado emocional moderadamente positivo
2018-Es-05873;Fui atacada por una tijerilla , habrá venganza. Buenas noches.;valence;-1;se infiere un estado emocional ligeramente negativo
2018-Es-05116;Tu mamá en vez de dar a luz dio oscuridad, pinche morra.;valence;-3;se infiere un estado emocional muy negativo
2018-Es-06300;No fue broma :( lo preguntó en serio hahahahaha;valence;0;se infiere un estado emocional neutral or mixto
2018-Es-06540;Inhala-exhala, no voy a caer en el juego, inhala-exhala... ;valence;-1;se infiere un estado emocional ligeramente negativo
2018-Es-06596;Al final de la oscuridad siempre se ve la luz;valence;1;se infiere un estado emocional ligeramente positivo
2018-Es-03990;@michellelovera5 @chochos Jajaja  igualitas ;valence;1;se infiere un estado emocional ligeramente positivo
2018-Es-02334;cansada de la gente;valence;-3;se infiere un estado emocional muy negativo
2018-Es-02287;@angiesmitha269 Yo másssss❤, por dicha ya pasó❤;valence;3;se infiere un estado emocional muy positivo
2018-Es-03663;@LindaStarVip2 @aneligarova65 Y yo a los 5000 iwal que tu!;valence;0;se infiere un estado emocional neutral or mixto
2018-Es-02281;"@BullDeMielda ""Sabes que no me ha bajado la regla, eso me tiene preocupada"" me dijo.";valence;-2;se infiere un estado emocional moderadamente negativo
2018-Es-01706;@FedericaaAraujo Me estabas echando por demostrarte mi amor. Estoy ofendido;valence;-3;se infiere un estado emocional muy negativo
2018-Es-03548;desde q me entere q entregamos la 🗝️🔑 estoy muy desanimada...😟;valence;-3;se infiere un estado emocional muy negativo
2018-Es-03802;Hay tanta timidez en mi cuando se trata de ti.;valence;-1;se infiere un estado emocional ligeramente negativo
2018-Es-00125;Encima que le escribí 84 cosas me contesta 3 palabras y más forra que nose que, copado amiga ;valence;-2;se infiere un estado emocional moderadamente negativo
2018-Es-01590;Menos mal que remata al suelo! ;valence;0;se infiere un estado emocional neutral or mixto
2018-Es-03325;@vaymosxpartes Insultos, denunciar la corrupción es insultar?;valence;-3;se infiere un estado emocional muy negativo
2018-Es-00940;Fui a nacer dond no hay nada tras esa linea que separa el bien dl mal mi tierra se llama miseria y no conozco la palabra libertad. #Irónico;valence;-2;se infiere un estado emocional moderadamente negativo
2018-Es-01122;se puso la 10 Flor con un buen café y peli d terror, esa es mi amiga;valence;0;se infiere un estado emocional neutral or mixto
2018-Es-04215;Ayer me baje dos juegos de terror y me da cosa jugarlos🙄;valence;-1;se infiere un estado emocional ligeramente negativo
2018-Es-01518;@esunen @sanchezcastejon Dónde está el insulto?;valence;-1;se infiere un estado emocional ligeramente negativo
2018-Es-01833;Esto del fin del mundo ya es como Juanito y el lobo, un día de estos ya no vamos a creer y boom desintegrados ;valence;-2;se infiere un estado emocional moderadamente negativo
2018-Es-03961;@fc_cordon Me has pillado! Somos los caminantes blancos, vamos, lo peor! #Ironía;valence;-1;se infiere un estado emocional ligeramente negativo
2018-Es-04551;Aaaaaa creo que entré en depresión culia;valence;-3;se infiere un estado emocional muy negativo
2018-Es-00538;@pepecandelaria @joelcanojr Con orgullo soy chillahermano. Chillé de alegría cuando les ganamos el campeonato.;valence;2;se infiere un estado emocional moderadamente positivo
2018-Es-00483;@Profeco @SECTUR_mx Tristemente lo dudo.;valence;-2;se infiere un estado emocional moderadamente negativo
2018-Es-00400;estoy viendo encantada por milesima vez y por milesima vez dije que estaba enamorada de patrick dempsey;valence;1;se infiere un estado emocional ligeramente positivo
2018-Es-01277;Soy la más emocionada porque ya puedo poner emojis a mis contactos 🎉;valence;2;se infiere un estado emocional moderadamente positivo
2018-Es-05636;Ay yo los amo a ustedes, yo puedo estar amargado, obstinado o deprimido pero ustedes son tan á, me hace reír todo el tiempo.;valence;1;se infiere un estado emocional ligeramente positivo
2018-Es-05813;@__kleos Ñiñiñiñiñi estoy indignada con la gente de esa zona. Cada día les soporto menos..;valence;-3;se infiere un estado emocional muy negativo
2018-Es-01909;No quisiera sentir celos pero lamentablemente no se me da.;valence;-2;se infiere un estado emocional moderadamente negativo
2018-Es-02926;@sivalenciac @bolivarmvb sólo haz ido sábado y no los otros días 😂 ve los otros días y después dices cuál es mejor;valence;0;se infiere un estado emocional neutral or mixto
2018-Es-00566;@JafetLuza colapso nervioso (culpa de dejar la medicación, sospecho) en medio de un examen. Una cosa humillante :(;valence;-3;se infiere un estado emocional muy negativo
2018-Es-02212;verás tú el cuadro esta noche tengo ;valence;-1;se infiere un estado emocional ligeramente negativo
2018-Es-02113;Ya esta conmigo el vestido, una preocupación menos;valence;0;se infiere un estado emocional neutral or mixto
