ID;Tweet;Dimension;Intensity;Description
2018-Es-00818;Este año me tocará ir sola a la Convención de DB 😬 Vamo a conocer otakus ;valence;0;se infiere un estado emocional neutral or mixto
2018-Es-06065;MB si no me equivoco una vez me confundi de snap y te mande terrible escracho mio jaja,me re copa q estes estudiando el prof suerte con eso💪;valence;0;se infiere un estado emocional neutral or mixto
2018-Es-00417;@cokep Que eres terrible fome! 🙄 Y añejo poh!;valence;-2;se infiere un estado emocional moderadamente negativo
2018-Es-00861;Gracias por informar temas de contingencia del país, preguntas claves para el proceso del país. #ironía #Tolerancia0;valence;-1;se infiere un estado emocional ligeramente negativo
2018-Es-01772;En Maipú hace falta una peluquería ATR ;valence;-1;se infiere un estado emocional ligeramente negativo
2018-Es-01969;Datos @FPCIUDADANA y @GobiernodeChile dicen q delincuencia ha bajado, sin/emb sensación d inseguridad sigue. Gran trabajo d la prensa ;valence;-2;se infiere un estado emocional moderadamente negativo
2018-Es-03177;@MartinezTobias1 AAAAA feliz día loquito,te extrañoo;valence;2;se infiere un estado emocional moderadamente positivo
2018-Es-05589;La gente siempre piensa que los estoy mirando mal. Yo no miro mal a nadie, tengo cara de amargado y ya.;valence;-2;se infiere un estado emocional moderadamente negativo
2018-Es-01809;Me sigue haciendo preguntas sobre el color de mis pies y hasta no responder todo no me va a decir el motivo de su curiosidad ;valence;0;se infiere un estado emocional neutral or mixto
2018-Es-02723;Amo que @Apple haya hecho una actualización para poner lento mi iphone. Lo amo de verdad. #Sarcasmo 😑;valence;-1;se infiere un estado emocional ligeramente negativo
2018-Es-02457;"Feliz día me dijo si habremos compartido baldes en lbbb"" JAJAJAJAJAAJAAJ";valence;2;se infiere un estado emocional moderadamente positivo
2018-Es-03260;No puedo esperar a que sea mañana y ver el súper drama que habrá en mi salón ;valence;-1;se infiere un estado emocional ligeramente negativo
2018-Es-00009;Soy demasiado ansiosa♀️;valence;-2;se infiere un estado emocional moderadamente negativo
2018-Es-05990;@guaperro1 Demasiado dulce 😅;valence;2;se infiere un estado emocional moderadamente positivo
2018-Es-03909;Me da risa cuando nadie me cree que me sigue Justin Bieber yyyyyyy me mando dm ;valence;2;se infiere un estado emocional moderadamente positivo
2018-Es-04012;Debería de estar leyendo, no viendo mis memes de hace dos años :( hasta llore de la risa... toot toot dooo;valence;1;se infiere un estado emocional ligeramente positivo
2018-Es-03525;Hola, ansiedad. Pasa. Llegas temprano.;valence;-2;se infiere un estado emocional moderadamente negativo
2018-Es-01591;send diversión en mi tl;valence;0;se infiere un estado emocional neutral or mixto
2018-Es-03331;@oficialHASSAM @Avianca Unos pocos como paralizan el país #ironía;valence;-2;se infiere un estado emocional moderadamente negativo
2018-Es-03947;@danuhfX Este tweet ha ofendido a los latinoamericanos;valence;-2;se infiere un estado emocional moderadamente negativo
2018-Es-03287;@albanagrigo Jajajajajajajajajajajaja fue lo mas y mas cuando perdió el arito jajjaajja;valence;3;se infiere un estado emocional muy positivo
2018-Es-04799;@CFCorrecaminos Y ese parche tan horrendo enfrente de la playera que pedo?  #Gacho;valence;-2;se infiere un estado emocional moderadamente negativo
2018-Es-00999;Los dos queremos pero nos mata la cobardía !!!;valence;-1;se infiere un estado emocional ligeramente negativo
2018-Es-04200;Siempre me ha gustado, encima es divertida, ¿qué más pedir?;valence;2;se infiere un estado emocional moderadamente positivo
2018-Es-05024;Estoy tan ansiosa por la 7ma temporada de Game of Throne que ya me siento una Targaryen.;valence;0;se infiere un estado emocional neutral or mixto
2018-Es-01636;q bien va sanidad en Andalucía ❤❤❤❤❤ #ironico;valence;0;se infiere un estado emocional neutral or mixto
2018-Es-00969;No te dejes llevar por el orgullo, escribele pa q te dejen en visto JAJAJAJJAJA ;valence;1;se infiere un estado emocional ligeramente positivo
2018-Es-05884;Un aplauso por esas personas que a pesar de estar jodidas, siempre buscan la manera de sacarte una sonrisa;valence;2;se infiere un estado emocional moderadamente positivo
2018-Es-01437;@1Ballesta1 nojoda que risa yo pq no te grabe ? ah verdad no tenía cel aún;valence;0;se infiere un estado emocional neutral or mixto
2018-Es-00624;#FloresParaNairo y como no enviárselas si @NairoQuinCo me hace sentir muy orgulloso de esta tierra que tantos hacen quedar mal;valence;-1;se infiere un estado emocional ligeramente negativo
2018-Es-06477;@El_Universal_Mx Pues a esperar más explosiones de júbilo y alegría por dicho nombramiento.;valence;1;se infiere un estado emocional ligeramente positivo
2018-Es-00873;"Pues en su intento por insultarme me dijo ""negro"" y ""marico"" y me pregunto que cuál será el nivel de este ser al decirme eso como insulto";valence;-2;se infiere un estado emocional moderadamente negativo
2018-Es-04150;@ZauberinB Buenos días !!! A por él ;valence;2;se infiere un estado emocional moderadamente positivo
2018-Es-01096;soy terrible yeta por la chucha por qué nací así;valence;-3;se infiere un estado emocional muy negativo
2018-Es-00947;😱😱😱😱escucharon ese trueno? ⚡️;valence;-2;se infiere un estado emocional moderadamente negativo
2018-Es-02420;@MarianaRodrigzC Jajajajajaja como cuando te exponen 😅;valence;0;se infiere un estado emocional neutral or mixto
2018-Es-02903;Que aburrido ni se para que tengo whatsaa;valence;-2;se infiere un estado emocional moderadamente negativo
2018-Es-02426;Hoy mi papá me dijo que está preocupado porque aún no tengo novio 😂🏻‍♀️💔;valence;1;se infiere un estado emocional ligeramente positivo
2018-Es-00615;@sergioaruizh :) gracias, aunque en este avatar si estoy muy producida y esa sonrisa jamás volvió.;valence;0;se infiere un estado emocional neutral or mixto
2018-Es-03996;Si Cataluña tuviera un dictador como Maduro mañana se celebraría el referendo con toda normalidad y mas aun, con apoyo del gobierno.#Ironía;valence;-2;se infiere un estado emocional moderadamente negativo
2018-Es-03433;Se enojo ,me dejo mandándolo a la mierda sola y se durmió.;valence;-3;se infiere un estado emocional muy negativo
2018-Es-06476;"@ZettaOfficial El ""lobo"" de los tres cerditos. Sigo indignado.";valence;-3;se infiere un estado emocional muy negativo
2018-Es-06320;Tengo pocos followers así q  impacto sería bajo pero me pasaría el día retuiteando a @gerardotc #ingenio #ironía en estado puro #periodismo;valence;-1;se infiere un estado emocional ligeramente negativo
2018-Es-03023;@DebRyanShow @TecnopolisNC #RutaPais2032 Mucha suerte🙏❤;valence;1;se infiere un estado emocional ligeramente positivo
2018-Es-04892;@sergioulloa1 Que indignación 😠, con esa plata podrían sacar a cuantas familias de la pobreza;valence;-3;se infiere un estado emocional muy negativo
2018-Es-01441;Pero a mi quien mierda me manda a elegir esta carrera de mierda... lease entre lineas (amo mi carrera y por eso me enojo) #Relatosalvaje;valence;-2;se infiere un estado emocional moderadamente negativo
2018-Es-04790;Juega vivo y piensa mal;valence;-2;se infiere un estado emocional moderadamente negativo
2018-Es-05528;@Tricker_FD Alguien que me entiende perfectamente Lamentablemente no tenemos control ante aquello;valence;-2;se infiere un estado emocional moderadamente negativo
2018-Es-03224;Meeentime que me gusta. ;valence;0;se infiere un estado emocional neutral or mixto
2018-Es-02429;@kalebalemayehu_ @NOCHlLLVlNES yo wtf ;valence;0;se infiere un estado emocional neutral or mixto
2018-Es-05036;@KRLS me ofrezco a imprimir papeletas para el referéndum ilegal si me las pagan bien, tengo impresora en casa. #ironia;valence;-1;se infiere un estado emocional ligeramente negativo
2018-Es-01562;Y nunca me habias provocado tanta risa, como hoy xD xD;valence;3;se infiere un estado emocional muy positivo
2018-Es-02838;Soy muy afortunada de tener a mi familia hobbit;valence;2;se infiere un estado emocional moderadamente positivo
2018-Es-02255;No creo en el pesimismo. Si las cosas no salieron como lo esperabas, sigue adelante. Si te empeñas lo consigues. Clint Eastwood;valence;0;se infiere un estado emocional neutral or mixto
2018-Es-02000;Me tienen sin internet y sin tvporcable por culpa d unas obras. 9am y veo bobesponja por clantv #graciasmovistar por la rapidez #ironia;valence;-2;se infiere un estado emocional moderadamente negativo
2018-Es-06368;@Corakoraa @TribunalCJ ira a la basura.una pena perder tiempo en ir a la  justicia burguesa;valence;-3;se infiere un estado emocional muy negativo
2018-Es-03451;Viste cuando estas ansioso para que salga él tema Mirame y se te hace eterno bueno así! @MaxiKilates @DakosMusic;valence;0;se infiere un estado emocional neutral or mixto
2018-Es-04429;@YoSoyAlita Amiga sería mega genial que puedas ir a ese lugar el 26!🙈🙊, esperemos que si se cumpla tu deseo!😉;valence;3;se infiere un estado emocional muy positivo
2018-Es-04010;Estoy tan ansiosa que mis uñas desaparecieron jaaaaj;valence;1;se infiere un estado emocional ligeramente positivo
2018-Es-04957;me siento muy frustrado conmigo mismo: me siento ansioso;valence;-3;se infiere un estado emocional muy negativo
2018-Es-05073;Y yo, lo único que quería es que lucharás por mi, por nosotros ;valence;-2;se infiere un estado emocional moderadamente negativo
2018-Es-00410;A las 8 me tengo que levantar y no puedo dormir ;valence;-1;se infiere un estado emocional ligeramente negativo
2018-Es-03205;Tengo tanto miedo a perderte, que prefiero morirme ahora para no perderte nunca. ;valence;-2;se infiere un estado emocional moderadamente negativo
2018-Es-02261;@AmorAlArte_ No nada, ya habíamos quedado en algo y usted ya perdió JAJAJAJAJAAJAJAJAJAJA;valence;0;se infiere un estado emocional neutral or mixto
2018-Es-05897;Se multará con hasta 300.000 euros a los que presidan las mesas electorales el día 1-O. Viva la democracia... #ironía #votarem #referèndum;valence;-2;se infiere un estado emocional moderadamente negativo
2018-Es-00063;brillito me salvo de un momento de desesperación como la amo;valence;1;se infiere un estado emocional ligeramente positivo
2018-Es-05898;-Mi amiga de la ibero que siempre me visita cuando estoy triste en León. Te quiero un buen amo la vibra y la alegría que siempre transmites.;valence;2;se infiere un estado emocional moderadamente positivo
2018-Es-06230;Que finde tan largo y tan lindo 😊;valence;3;se infiere un estado emocional muy positivo
2018-Es-05265;@A3Noticias Que bien se lo pasan en Cataluña!! El pais k yo quiero!!! #ironía;valence;-1;se infiere un estado emocional ligeramente negativo
2018-Es-02794;Nada más triste que no tener a quien dedicarle tus goles.;valence;-2;se infiere un estado emocional moderadamente negativo
2018-Es-03892;me acaban de ofrecer un vaso de orina, mi suerte está cambiando  #CD9 #Coders #AlonsoVillalpandoTrendy #KCAMexico;valence;-1;se infiere un estado emocional ligeramente negativo
2018-Es-04528;Es muy fuerte El otro día estaba escuchando Leave out all the rest, me pone tan melancólica esa canción  Que si la escucho ahora...;valence;-1;se infiere un estado emocional ligeramente negativo
2018-Es-06375;Dios me bendice todos los días si no aquien le debo mi gloria y fortuna 😇😇😇;valence;3;se infiere un estado emocional muy positivo
2018-Es-05686;@xsangrelatina Y las respuestas de la mina fueron súper agresivas, según ella porque es de color colo y lo hizo a propósito ;valence;-1;se infiere un estado emocional ligeramente negativo
2018-Es-02962;@_javiercardenas Con Otegui vitoreado como una ciudadano ejemplar por Barcelona. #sarcasmo;valence;-2;se infiere un estado emocional moderadamente negativo
2018-Es-00955;En la comida canalizo todo, sea felicidad, tristeza, aburrimiento, bajon, ansiedad y todo lo que exista. No tengo solucion.;valence;-1;se infiere un estado emocional ligeramente negativo
2018-Es-03156;Evadirse del Problema Interior Provocado por la Personalidad no Es más que Avocarse hasta el Dolor, el Estrés,el Agobio o el Malestar.;valence;-2;se infiere un estado emocional moderadamente negativo
2018-Es-06853;Mi sobrina sigue en cama. No ha comido en varias horas. Parece que la energía del cuerpo se le ha ido. La luz le molesta un poco. #tristeza;valence;-3;se infiere un estado emocional muy negativo
2018-Es-05354;@JSalazar9 Nah es entretenido sacarlo de sus casillas...;valence;0;se infiere un estado emocional neutral or mixto
2018-Es-06419;🎵 San Cristobal, San Francisco y mi San Andrés Xecul. yo te canto emocionado cuna de Atanasio Tzul.;valence;2;se infiere un estado emocional moderadamente positivo
2018-Es-05339;@juankfromchile En todo caso fue entretenida la conversación , buenas noches;valence;0;se infiere un estado emocional neutral or mixto
2018-Es-06775;7. Café oscuro. A la sombra parece negro, pero es café xD (Me doy cuenta de que repetí 5 dos veces, lel);valence;1;se infiere un estado emocional ligeramente positivo
2018-Es-03705;Es ver eso y romper en llanto😟;valence;-3;se infiere un estado emocional muy negativo
2018-Es-00344;@samario2 @YFERLEYHR @petrogustavo Habla de Terrorismo y se esconde detrás de un nick falso, pobre Uribestia ardido;valence;-3;se infiere un estado emocional muy negativo
2018-Es-00607;Mañana es mi acto de graduación y no puedo dormir por la ansiedad.;valence;0;se infiere un estado emocional neutral or mixto
2018-Es-03726;@ToritaMyQueen @Valentin_Ass Eso lo hace más gracioso aún;valence;1;se infiere un estado emocional ligeramente positivo
2018-Es-03453;"Hoy tuve la fortuna de conversar con dos amigos @pavidonavido @CronistaDelMame en la presentación del libro""vaga ambición ""@AntonioOrtugno";valence;1;se infiere un estado emocional ligeramente positivo
2018-Es-05687;Iker tiene dormido todo el dia, nomas despierta a comer y con los ojos cerrados ;valence;0;se infiere un estado emocional neutral or mixto
2018-Es-02880;@VjRodil @tugorditafav Esto me dio mucha risa JAJAJA;valence;2;se infiere un estado emocional moderadamente positivo
2018-Es-06647;@letrasencilla Debes colocar las respectivas alarmas 6:00 am, 6:30am y 6:59 am 😅;valence;0;se infiere un estado emocional neutral or mixto
2018-Es-00149;Si me gusto la feria 😍;valence;2;se infiere un estado emocional moderadamente positivo
2018-Es-01300;Me quede dormida estudiando y me desperté a las 3:20 AM.  Adivinen quien tiene la perra al lado? Un miedo ;valence;-3;se infiere un estado emocional muy negativo
2018-Es-02800;@xBxnsheeAriel @LobaDxlDesierto @psychofhabit Pero ella es mala mami, muy muy mala * digo mirando a Corrida enfadada*;valence;-1;se infiere un estado emocional ligeramente negativo
2018-Es-01930;Ya no sabia que decirle. Menos mal que metí la excusa que me voy a dormir ;valence;-2;se infiere un estado emocional moderadamente negativo
2018-Es-04606;@arcasmarc1 @PPopular @_virginiavargas Para qué hablar de derechos humanos, si con insultar basta no crees?;valence;-2;se infiere un estado emocional moderadamente negativo
2018-Es-01881;Ir a su casa y ponerle una goliza en el FIFA: me siento entretenido(a);valence;2;se infiere un estado emocional moderadamente positivo
2018-Es-02014;Tienen cada salida a veces estos pendejos q me hacen cagar de risa;valence;2;se infiere un estado emocional moderadamente positivo
2018-Es-02034;@jocelynmb_ Ya hubiera tumbado la puerta ;valence;-2;se infiere un estado emocional moderadamente negativo
2018-Es-00015;Qué odio y desesperación estar tan lejos de Tito en este momento! Unas ganas de abrazarlo fuerte, mi sol😳.;valence;-2;se infiere un estado emocional moderadamente negativo
2018-Es-00418;@Camila_Cabello @BrunoMars ESTOY ORGULLOSO DE Tİ ❤👏;valence;3;se infiere un estado emocional muy positivo
2018-Es-03114;El coño e su madre , tembló aquí en Caracas. En la castellana ;valence;-2;se infiere un estado emocional moderadamente negativo
2018-Es-04157;Que ganas de tener mucha plata y tatuarme, comprarme ropa y muchas cocas y hamburguesas ;valence;0;se infiere un estado emocional neutral or mixto
2018-Es-06828;@hermanntertsch La furia de Yavé cayó sobre ellos :);valence;-1;se infiere un estado emocional ligeramente negativo
2018-Es-01418;Mi huerta necesita agua con desesperación y yo me duermo.;valence;-2;se infiere un estado emocional moderadamente negativo
2018-Es-06656;Sonreír a pesar de todas las cosas que pasen es de valientes;valence;0;se infiere un estado emocional neutral or mixto
2018-Es-04562;El pueblo le pasa por ensima a la mud y sin conducción este espiral de violencia se volverá muerte y mas muerte lamentablemente;valence;-2;se infiere un estado emocional moderadamente negativo
2018-Es-03233;Cuando tenía 16 , veía a los de 25 como mayores , súper mayores , meeeega mayores ! 😆 ay papá!;valence;1;se infiere un estado emocional ligeramente positivo
2018-Es-02932;Quiero ser la parte divertida de tu libro.;valence;1;se infiere un estado emocional ligeramente positivo
2018-Es-06653;Hoy me dispongo a ver el partido para distraerme de la depresión de no haber ido al MAT🙂🙂;valence;-2;se infiere un estado emocional moderadamente negativo
2018-Es-03336;@estevograndal @DDominguez_10 @carlosbertalo_ El palo  no va a funcionar subnormal😤;valence;-1;se infiere un estado emocional ligeramente negativo
2018-Es-05701;Me cago de risa viendo vídeos de @Rubeooh 😂😍;valence;3;se infiere un estado emocional muy positivo
2018-Es-02010;Te siento en carne viva ,me desperté llorando y supe ,supe que hoy volvías;valence;-1;se infiere un estado emocional ligeramente negativo
2018-Es-04533;Es muy fácil sonreír  y filosofar cuando es otro el que esta echo mierda;valence;-2;se infiere un estado emocional moderadamente negativo
2018-Es-05062;@unacrisparra @almendra_78 Pues yo en su casa we ;valence;-1;se infiere un estado emocional ligeramente negativo
2018-Es-04172;Tengo tremendas ganas de salir a caminar ahora pa sacarme un poco la decepción y el enojo y pensar bien q voy a hacer;valence;-3;se infiere un estado emocional muy negativo
2018-Es-01048;really paula chaves es una de las mejores modelos de arg con esa walk? lamentable;valence;-1;se infiere un estado emocional ligeramente negativo
2018-Es-01791;Hoy que estoy ansiosa a la gente le da con  joder‍♀️;valence;-2;se infiere un estado emocional moderadamente negativo
2018-Es-06323;@ricardoy337 Que fome. Pero nose porque me reí igual ;valence;0;se infiere un estado emocional neutral or mixto
2018-Es-04421;@jimeramirez0109 Si por dicha ❤;valence;1;se infiere un estado emocional ligeramente positivo
2018-Es-02433;Mejor Dime Que Me Extrañas! 🙁;valence;-1;se infiere un estado emocional ligeramente negativo
2018-Es-06496;Voy a contener mi rabia contra los que bancan a miss bolivia;valence;-2;se infiere un estado emocional moderadamente negativo
2018-Es-03159;Si eres tranquilo y confiado, o miedoso y con baja autoestima, depende de la dopamina (hormona del placer).;valence;-1;se infiere un estado emocional ligeramente negativo
2018-Es-00844;#DeColombiaMeGusta la cultura, la alegría y las mujeres.;valence;0;se infiere un estado emocional neutral or mixto
2018-Es-02850;Ante última alarma 👐😍 #LaFelicidaaaat;valence;2;se infiere un estado emocional moderadamente positivo
2018-Es-01357;Que indignación le tengo al chabón que me dijo prostituta por llevar puesto un cancán calado. La puta que te parió. Ni que fuera de red man.;valence;-3;se infiere un estado emocional muy negativo
2018-Es-02801;Estoy totalmente indignada con lo que me acaba de decir este chico;valence;-3;se infiere un estado emocional muy negativo
2018-Es-06252;@armando_bubu @CNNEE Ya decia yo. Era el sospechoso principal. Jajajaja;valence;1;se infiere un estado emocional ligeramente positivo
2018-Es-04433;@_itsdesconocida Lo se , eso es lo importante jajajaja ;valence;2;se infiere un estado emocional moderadamente positivo
2018-Es-02764;Extraño sentir sus manitos en mi cara, su risa, TODO 😭👶💕;valence;-1;se infiere un estado emocional ligeramente negativo
2018-Es-03911;Qué onda sonreír y que los cachetes te tapen la mitad del ojo?;valence;1;se infiere un estado emocional ligeramente positivo
2018-Es-01345;@MexicanCodersMX Ya me había emocionado  #CD9 #Coders #AlonsoVillalpandoTrendy #HarryStyles #KCAMexico;valence;1;se infiere un estado emocional ligeramente positivo
2018-Es-04469;@LaPauHC @lily_v13 Soy taaaaaaan chistoso. ¿Verdad?;valence;1;se infiere un estado emocional ligeramente positivo
2018-Es-00047;En la línea borbónica, haciendo las cosas bien #ironía #deguatemalaaguatepeor #IIIRepublica #rajoydimision #felipeVI #elpacificador;valence;0;se infiere un estado emocional neutral or mixto
2018-Es-00088;Cumplir un festivo no es nada cool amigos.;valence;-1;se infiere un estado emocional ligeramente negativo
2018-Es-01316;10-A veces escribo en mayúscula para demostrar que estoy emocionado.;valence;0;se infiere un estado emocional neutral or mixto
2018-Es-05985;¿Sabéis el pulpo de buscando a Dory? ¿Recordáid que le faltaba un tentáculo y que vivía totalmente amargado y resentido?;valence;-2;se infiere un estado emocional moderadamente negativo
2018-Es-02098;Quien tributa en tu país ayuda a mejorar tu bienestar Eso ponía en un taxi. Qué mal se defienden.;valence;-1;se infiere un estado emocional ligeramente negativo
2018-Es-03902;Ultima semana de mes..🙌💪👏 #BuenInicioDeSemana #MuchaTranquilidad #Felicidad;valence;3;se infiere un estado emocional muy positivo
2018-Es-01117;Ches mamadas que digo Mi cerebro procesa pendejadas a nivel industrial y cantidades inifinitas a cada segundo ;valence;-1;se infiere un estado emocional ligeramente negativo
2018-Es-04349;🙏 dios esta conmigo 😞💔: me siento deprimida;valence;-3;se infiere un estado emocional muy negativo
2018-Es-02737;"Estoy entre ""quiero ahorrar dinero""💵 y ""solo se vive una vez"".👀✌😉#Sarcástica🌺 #SabadoDeGanarSeguidores 🙌 #SiguemeYTeSigo👌";valence;0;se infiere un estado emocional neutral or mixto
2018-Es-02783;No pagues mas karaoke con animación luces pantallas humo y toda la diversión Separa tu fecha 9811864230;valence;0;se infiere un estado emocional neutral or mixto
2018-Es-01246;Encima se enojo vieron es más tonto;valence;-3;se infiere un estado emocional muy negativo
2018-Es-01597;@armijo_victor JAJAJAJAJAJAJAJAJAJ Chtm, me refería a depresión wey ☹️;valence;-2;se infiere un estado emocional moderadamente negativo
2018-Es-04353;Mis amigos lo son todo, ojalá nunca me falten. ¡Feliz día! Los amo ❤️;valence;3;se infiere un estado emocional muy positivo
2018-Es-02048;La Copa Oro se juega todos los días de todos los años desde que existe el futbol;valence;0;se infiere un estado emocional neutral or mixto
2018-Es-03231;Estaba buscando fotos y encontre unas de un xv con Manu cuando recien nos conociamos era re amargo Manuel. Hasta encontre fotos con Agustin😂;valence;2;se infiere un estado emocional moderadamente positivo
2018-Es-00025;@SEAT_Mexico Valdrá la pena después de  60 días de lo sucedido ?? Lo hecho, hecho está;valence;-1;se infiere un estado emocional ligeramente negativo
2018-Es-05978;Hasta el hueso una de las pelis que quería que durará más ;valence;0;se infiere un estado emocional neutral or mixto
2018-Es-00745;Lo único que me esta saliendo bien este año es engordar ;valence;-1;se infiere un estado emocional ligeramente negativo
2018-Es-00644;Que gil fui en no comprar las entradas para ir a ver a ciro ;valence;-1;se infiere un estado emocional ligeramente negativo
2018-Es-04455;¿POR QUÉ LA ESCENA DE LILY DISFRAZADA DE BALLENA EN EL APARTAMENTO VACÍO ME HIZO LLORAR TANTO? AHHH;valence;-2;se infiere un estado emocional moderadamente negativo
2018-Es-04221;@ElmemoV Alabado sea el descuento jajajaj ;valence;2;se infiere un estado emocional moderadamente positivo
2018-Es-02501;@Anitaprr Lo que pasa es que el toque de bruja nadie nos lo quita ;valence;1;se infiere un estado emocional ligeramente positivo
2018-Es-00628;"EL GATO EN SU CONDICION ; CREE QUE TOD@S SON IGUALES .. A EL / ELLA .. #SARCASMO #REAL";valence;-3;se infiere un estado emocional muy negativo
2018-Es-01434;Como es que a la facu llego una hora después y para el teaser despierto mágicamente sin alarma y justo a tiempo?   #BAMA2017_EXO;valence;0;se infiere un estado emocional neutral or mixto
2018-Es-06332;@EPN Estás a 1 minuto de llegar a Chiapas, Bueno a menos.. a 5.  Ay Peñitaaaaa ;valence;-1;se infiere un estado emocional ligeramente negativo
2018-Es-00858;@AnitaBotwin Porque claro, esta gente son una grandísima banda peligrosa que maneja artefactos explosivos chungos. #Ironía;valence;-3;se infiere un estado emocional muy negativo
2018-Es-06448;Hoy te das cuenta quien si se acuerda de vos y quien no, que agradable de día;valence;1;se infiere un estado emocional ligeramente positivo
2018-Es-01373;@paspadita Dale, lo vicho! Muchas gracias!! 😊;valence;3;se infiere un estado emocional muy positivo
2018-Es-00480;Pensando fríamente él wall no me gusto 😕;valence;-2;se infiere un estado emocional moderadamente negativo
2018-Es-04679;@abi_quesada @AleVarela08 Tan violenta ;valence;-2;se infiere un estado emocional moderadamente negativo
2018-Es-06705;@Azulinca Recordarle que solo es una película así me calmaron a mi jaja :( 😅;valence;1;se infiere un estado emocional ligeramente positivo
2018-Es-05139;@KevenYHensy Hasta Yo Estoy Orgullosa😍;valence;3;se infiere un estado emocional muy positivo
2018-Es-04960;WOW HAN VISTO A PIQUÉ VOTANDO. COMO SE LE OCURRE VOTAR. FUERA DE LA SELECCIÓN ESPAÑOLA. (#ironía);valence;-1;se infiere un estado emocional ligeramente negativo
