ID;Tweet;Dimension;Intensity;Description
2018-Es-03768;#IrreversibleMaldad El amariconao se queja por el hijo de su polola. El pack se recibe completo. ;valence;-2;se infiere un estado emocional moderadamente negativo
2018-Es-01009;El subnormal diciendo que le hemos amenazado xdddddddddd;valence;-2;se infiere un estado emocional moderadamente negativo
2018-Es-02819;Cuándo van a entender que el aborto se práctica igual estén de acuerdo o no, que deje de ser considerado ilegal no provocaría tantas muertes;valence;-3;se infiere un estado emocional muy negativo
2018-Es-00826;@Missing_Marijo Se parece mucho...... que lamentable!! 😌;valence;-2;se infiere un estado emocional moderadamente negativo
2018-Es-02087;@Maguizanini Ah sos graciosa sos;valence;0;se infiere un estado emocional neutral or mixto
2018-Es-05902;Informe del acto: se trata de quema de basura y escombro, sin peligro de propagación, se trabaja @PrimeraCoquimbo @Cuarta_Coquimbo;valence;-2;se infiere un estado emocional moderadamente negativo
2018-Es-04851;@AxelGarciaDc ya nada bby 😆;valence;2;se infiere un estado emocional moderadamente positivo
2018-Es-03278;@_Robrtoo JAJAJAJAJAJAJA Estas bien pendejo. 😂;valence;2;se infiere un estado emocional moderadamente positivo
2018-Es-05224;Como se atreve a venir a mi casa asi como asi ;valence;-3;se infiere un estado emocional muy negativo
2018-Es-01529;Acullá, saya, sayo, sayón, vid, atropello, afligir, aflicción, yute, vitud... ^_^;valence;0;se infiere un estado emocional neutral or mixto
2018-Es-03854;@PeliOviedo5 Jajajajajjajjajajajajajajajajajaja tremenda experiencia,;valence;2;se infiere un estado emocional moderadamente positivo
2018-Es-03286;Me enfurece la gente que desconoce la importancia de cada delegación en la Cd de México #ira 😠;valence;-3;se infiere un estado emocional muy negativo
2018-Es-05378;Siempre estoy enojada, es mi don.. mi maldición.;valence;-3;se infiere un estado emocional muy negativo
2018-Es-00982;@TubinoCarlos @KeikoFujimori Bah..solo vi la resentida de siempre!;valence;-2;se infiere un estado emocional moderadamente negativo
2018-Es-04609;Sabemos que la vida es dura pero la amargura no es la solución ♪ #LVP;valence;2;se infiere un estado emocional moderadamente positivo
2018-Es-06030;@SolDeusebio Chistosa 🙄😑😑😑😑;valence;-1;se infiere un estado emocional ligeramente negativo
2018-Es-06157;@maagas2 @maii_sanchez Magui siempre pensando en comer vos, jajajaja pinta ese mc furioso bue;valence;0;se infiere un estado emocional neutral or mixto
2018-Es-02348;El que esta segurisimo que el mercado ira hacia tal o tal dirección ya perdio. #Bitcoin;valence;-1;se infiere un estado emocional ligeramente negativo
2018-Es-04631;Que cosa horrible estar resfriado y no sentirle el gusto a la comida;valence;-3;se infiere un estado emocional muy negativo
2018-Es-03888;Que manera de cargarme de risa en ese baby shawer. ;valence;3;se infiere un estado emocional muy positivo
2018-Es-03566;"No tengo wifi y no me descargue ninguna serie para ver, entonces me toca acostarme ""temprano"" y eso que mañana es festivo.  Odio todo";valence;-3;se infiere un estado emocional muy negativo
2018-Es-03907;En cinco minutos mezclé dulce con salado, hablame de tener ansiedad y estar nerviosa. En cualquier momento vómito todo, lo siento;valence;-2;se infiere un estado emocional moderadamente negativo
2018-Es-04755;Con que me levanto mañana 🤔 tremenda noche 🍷😂;valence;0;se infiere un estado emocional neutral or mixto
2018-Es-06846;@ShunOfLove -Cuánta confianza y alegría, sobretodo su 0 temor a el... Pero bueno. Sonrisa leve- ¡Gracias, chica!~;valence;3;se infiere un estado emocional muy positivo
2018-Es-04125;@fabiestefer Como que no 😠..uuufff Deoos mio mánda más pasiencia que se me está acabando con esta mujer;valence;-3;se infiere un estado emocional muy negativo
2018-Es-06094;@Seba_Ballester Jajaj si fue divertido dispararle a ese negro 🙂😐;valence;0;se infiere un estado emocional neutral or mixto
2018-Es-02202;Me mantuvo entretenida pero no tanto como quisiera... si lo suficiente para seguirla... siempre y cuando no hagan lo mismo del 1 ep.;valence;0;se infiere un estado emocional neutral or mixto
2018-Es-01482;@futpicante @Faitelson_ESPN la mesa se volvio un circo, tratar de justificar algo que no se debe esta mal y le da risa al Cheliz.;valence;-1;se infiere un estado emocional ligeramente negativo
2018-Es-06277;Huele a manteca quemada... a no ya se enojo lacerda🤣🤣🤣🐽🐷;valence;-2;se infiere un estado emocional moderadamente negativo
2018-Es-00530;@FuriaRojaTV Torres es muy terco perdió en el estadio donde le gritan alos dt burro;valence;-1;se infiere un estado emocional ligeramente negativo
2018-Es-01993;Un excelente #lunes y un gran cierre de #Septiembre para todos, con #Alegria y #Esperanza como dice el @Pontifex_es;valence;2;se infiere un estado emocional moderadamente positivo
2018-Es-05863;Y el Rey, el preparado, supongo q estará ideando una intervención estelar q nos dejará boquiabiertos a todos los españoles #2Oct #Ironía;valence;-1;se infiere un estado emocional ligeramente negativo
2018-Es-00114;"#Ironía, que mexicanos se solidaricen con el deseo de independencia catalán como si aquí fueramos plenamente ""independientes"".";valence;-1;se infiere un estado emocional ligeramente negativo
2018-Es-00848;@alexlozano779 Que malooooo ;valence;-2;se infiere un estado emocional moderadamente negativo
2018-Es-02462;La felicidad no consiste en todo tener, sino en saber sacar lo bueno que te da. #Fav #RT #FF #UnaVidaPk #felicidad;valence;1;se infiere un estado emocional ligeramente positivo
2018-Es-04996;Y pesar de todo el es la única persona por la que me arriesgaría una vez más a amar.;valence;0;se infiere un estado emocional neutral or mixto
2018-Es-04797;Le dije a mi papá que le ponga los punto a sus jugadores, con la mirada me dijo todo ;valence;-2;se infiere un estado emocional moderadamente negativo
2018-Es-06733;Mi novio subió una foto conmigo durmiendo a instahistory y recién la veo. La venganza sera terrible 😘😘😘;valence;0;se infiere un estado emocional neutral or mixto
2018-Es-00622;@IvanMarquezFARC Llena de satisfacción y orgullo a la Colombia de gente buena, no a la Colombia de hijos de puta asesinos como usted...;valence;-2;se infiere un estado emocional moderadamente negativo
2018-Es-03974;Así que lamentablemente el mundo del Rock está de luto #QEPD Chester Bennington;valence;-3;se infiere un estado emocional muy negativo
2018-Es-01945;@Abran_Dalmr @Gustavo_Soagui @Annett83236709 @SkyAlertMx Si muchas gracias ;valence;0;se infiere un estado emocional neutral or mixto
2018-Es-02847;Me puse a ver vídeo desde que Hobi debutó, el orgullo y felicidad que es ver todo lo que ha logrado, y que pronto sacara su mixtape no puedo;valence;1;se infiere un estado emocional ligeramente positivo
2018-Es-02285;Tengo tres dias sin fumar mota, me siento orgullosa jaja.;valence;1;se infiere un estado emocional ligeramente positivo
2018-Es-04342;Que es hora de buscarme una novia y de enamorarme. ;valence;0;se infiere un estado emocional neutral or mixto
2018-Es-02047;Hoy soy feliz con poco con mi tristeza me basta;valence;0;se infiere un estado emocional neutral or mixto
2018-Es-03995;@CatalinaSpring Jajajajajaja que rabia;valence;0;se infiere un estado emocional neutral or mixto
2018-Es-01756;"Es gracioso como siempre terminas con la que juras que jamás te fijarías porque está bien ""qlera"" 🏻‍♀️";valence;-1;se infiere un estado emocional ligeramente negativo
2018-Es-05264;alv los old tweets me tienen bien inspirada ;valence;1;se infiere un estado emocional ligeramente positivo
2018-Es-03725;ver esas transmisiones de crunchy es peor que pasar oyendo esa horrenda canción que se hizo popular en este hemisferio;valence;-1;se infiere un estado emocional ligeramente negativo
2018-Es-01995;Quw bronca loco esta vieja de mierda cocina lo que se le encanta el orto y sabe q no me gusta ;valence;-2;se infiere un estado emocional moderadamente negativo
2018-Es-01933;Estoy re deprimida hace meses y a nadie le importa, ni siquiera lo notan. Pero yo si me tengo que preocupar por como se sienten los demas;valence;-3;se infiere un estado emocional muy negativo
2018-Es-01631;Hank, el pulpo de Buscando a Dory, le dió su tentáculo/pene a una pulpa que le abandonó. Por eso vive amargado y resentido.;valence;-1;se infiere un estado emocional ligeramente negativo
2018-Es-01350;@antenaxxx2 De los creadores de Bendecida y Afortunada llega blindada por mi novio feo pero narco. #Susto;valence;0;se infiere un estado emocional neutral or mixto
2018-Es-01850;Tengo las conversaciones mas interesantes con el. 😊;valence;3;se infiere un estado emocional muy positivo
2018-Es-05755;Se me vienen cosas a la cabeza sin sentido que después ocurren,por ej la muerte de alguien o un accidente. ;valence;-2;se infiere un estado emocional moderadamente negativo
2018-Es-00104;No me puedo dormir bo, si alguien me habla no me enojo;valence;-1;se infiere un estado emocional ligeramente negativo
2018-Es-01386;Brillas en lo más alto amiguito. Feliz dia para vos. Te amo y extraño tanto! 👼💟;valence;1;se infiere un estado emocional ligeramente positivo
2018-Es-00121;Uh me re emocione con esa canción ;valence;2;se infiere un estado emocional moderadamente positivo
2018-Es-04880;@Javelez12 Jajajajaj no pana lo veo grave a páginas por casualidad no se metió a youtube?;valence;0;se infiere un estado emocional neutral or mixto
2018-Es-04692;Detesto que la gente que esta deprimida llegue a ponerlo a uno igual o peor.;valence;-3;se infiere un estado emocional muy negativo
2018-Es-00675;Angeles me cuidan y guían mi bienestar🎵;valence;3;se infiere un estado emocional muy positivo
2018-Es-04203;40 minutos soñando algo horrible, lpm tengo miedo de dormirme ahora 😢;valence;-3;se infiere un estado emocional muy negativo
2018-Es-02446;Gracias buses x ser tan puntuales #ironia #mecagoento #siempretarde  🙃🙃🙃;valence;-2;se infiere un estado emocional moderadamente negativo
2018-Es-02472;Mi papa se arrecha y no me manda nada y cuando se contenta me arrecho yo y de igualito no me manda un coño. 😒😒;valence;-2;se infiere un estado emocional moderadamente negativo
2018-Es-01775;@sigfrid Sería mucho más genial si Telltale dejará de hacer novelas y empezara hacer videojuegos!;valence;1;se infiere un estado emocional ligeramente positivo
2018-Es-02997;@LuchoCassinotti yo no pq me dijiste resentida y sabes q no lo soy;valence;-2;se infiere un estado emocional moderadamente negativo
2018-Es-04239;To super cansada 😴;valence;-2;se infiere un estado emocional moderadamente negativo
2018-Es-06036;Eu si me dan otra semana de vacaciones no me enojo;valence;0;se infiere un estado emocional neutral or mixto
2018-Es-05557;@wilnowil Dependiendo de cuán ansiosa sea (que se las quita con la otra mano) o si hace mucho oficios en la casa.;valence;0;se infiere un estado emocional neutral or mixto
2018-Es-05520;Los borrachos cagandose a piñas y nosotros corriendo con Mica ;valence;0;se infiere un estado emocional neutral or mixto
2018-Es-03503;@sopitas Ahora sabemos porque tan sonriente en las fotos, seguramente decía pobres pendejos los que creen esto;valence;-1;se infiere un estado emocional ligeramente negativo
2018-Es-02292;Lo mejor es confiar en que vas a pasar el examen con lo poco que se te grabo en clase ;valence;0;se infiere un estado emocional neutral or mixto
2018-Es-02377;Me queme con aceite hirviendo, no se dan una idea de lo que arde. Quiero llorar.;valence;-3;se infiere un estado emocional muy negativo
2018-Es-04853;chicas no saben lo cuanto q estoy ansiosa para sábado es algo q no puedo explicar;valence;1;se infiere un estado emocional ligeramente positivo
2018-Es-05155;@shaiel_kosinski Sos re chistosa eh (extraño el rubio);valence;2;se infiere un estado emocional moderadamente positivo
2018-Es-00438;¿y qué tiene la sonrisa más preciosa de todas?;valence;2;se infiere un estado emocional moderadamente positivo
2018-Es-02875;@pardodevera @palzaga Pues está muy claro lo que ha dicho, y decir las cosas como son no es faltar a la verdad ni ofender a nadie.;valence;-1;se infiere un estado emocional ligeramente negativo
2018-Es-02660;@DanielEguiluz Jajaja nel, sino tu mamá me va a echar la culpa. A parte recuerda que yo estoy de vacaciones. ;valence;1;se infiere un estado emocional ligeramente positivo
2018-Es-01662;Final emocionante hein?! @Vessoni @RicaPerrone #Ironia;valence;0;se infiere un estado emocional neutral or mixto
2018-Es-01241;Creí que dejar de fumar weed durante el día me haría sentirme less shitty y más productiva pero veeerga es demasiado aburrido estar sobria;valence;-2;se infiere un estado emocional moderadamente negativo
2018-Es-02519;@novaimperio @ROYALE_ARGENTO @CCRCUP Y para q lo hacen si concuerdan? ;valence;0;se infiere un estado emocional neutral or mixto
2018-Es-02520;@sweetmygomez awww linda :’) don’t worry, a mi también se me pasa 😅;valence;1;se infiere un estado emocional ligeramente positivo
2018-Es-02278;Estoy escabiando desde las 11 de la mañana tipo me desayune una birra y me voy a ir tomando una ;valence;0;se infiere un estado emocional neutral or mixto
2018-Es-01952;Aqui convenciendo a mis amigas con novio que me lleven de violín al cine en el 3x2 de cinemarck ;valence;-1;se infiere un estado emocional ligeramente negativo
2018-Es-04568;Quiero mi buzo de vuelta, canutas 👊;valence;-3;se infiere un estado emocional muy negativo
2018-Es-02652;JAJAJAJAJAJAJAJJAJAJAA yo no te la puedo creerrrrr ;valence;2;se infiere un estado emocional moderadamente positivo
2018-Es-01050;@pistxls Hades bebé, sabes que te adoro, eres mi girl crush. Amo lo graciosa que eres y que siempre te preocupas por los demás. +;valence;2;se infiere un estado emocional moderadamente positivo
2018-Es-03824;Una casita en la lunaaaaa ,con otro de fortuna bebeeee;valence;2;se infiere un estado emocional moderadamente positivo
2018-Es-05115;Cuando un niño hace un berrinche porque querían un hermanito en vez de hermanita. Qué propones? Que aborte la mamá y lo intente otra vez?;valence;-2;se infiere un estado emocional moderadamente negativo
2018-Es-05435;no sé sonreír;valence;-2;se infiere un estado emocional moderadamente negativo
2018-Es-04498;no me tiro para atras no me importa quien sos no sean tan cobarde y boxea con este chabon 🎶😛;valence;-1;se infiere un estado emocional ligeramente negativo
2018-Es-00551;va mejor venganza contra quien rompio tu corazon, es demostrar que eres nerfectamente capaz de ser feliz sin el/ella.;valence;0;se infiere un estado emocional neutral or mixto
2018-Es-01999;peleo para terminar llorando;valence;-3;se infiere un estado emocional muy negativo
2018-Es-06366;Afortunado de encontrarte. 💘;valence;3;se infiere un estado emocional muy positivo
2018-Es-04586;@pcayuqueo He visto demonios vistiendo santos, pero estos tipos por lejos los más cínicos 😒😒;valence;-2;se infiere un estado emocional moderadamente negativo
2018-Es-06324;Felicidad extrema es estar super aburrida y encontrar una película de Harry potter😍;valence;2;se infiere un estado emocional moderadamente positivo
2018-Es-02676;supongo que una se cansa de hacer daño y huye como una cobarde (te dejé de seguir bloqueándote y desbloqueándote, no entré en tu cuenta);valence;-1;se infiere un estado emocional ligeramente negativo
2018-Es-02922;@MilagrosLeivaG @RPPNoticias Porqué negó vínculos con apristas a pesar de las fotos? Si nada debe o teme?;valence;-1;se infiere un estado emocional ligeramente negativo
2018-Es-00085;@maneSC290_ Yo lo hago por gusto homs;valence;1;se infiere un estado emocional ligeramente positivo
2018-Es-03748;@CaracolRadio Deberían destinarle esos recursos al @sitpbogota . #Ironía #Incentivanelrobo;valence;-1;se infiere un estado emocional ligeramente negativo
2018-Es-00190;Mañana en Ayunas 😭😭  Chingue su madre 😄;valence;-1;se infiere un estado emocional ligeramente negativo
2018-Es-04251;Que desasosiego es enfrentarse a cosas tan difíciles.;valence;-2;se infiere un estado emocional moderadamente negativo
2018-Es-03193;@milagrosmartell No puedo más enserio tenemosque hablar 😭;valence;-2;se infiere un estado emocional moderadamente negativo
2018-Es-00292;@RocioPereyra22 Jsajak no puedo soy muy ansioso;valence;0;se infiere un estado emocional neutral or mixto
2018-Es-02514;Me desconecte de todo, un buen escape. Por si andaban con el pendiente ;valence;0;se infiere un estado emocional neutral or mixto
2018-Es-06692;@LaTiadeltunco @oveflores la capital de Guate es idéntica a N capital SS en cuanto a orden, limpieza y seguridad ... 😒 #Sarcasmo;valence;-1;se infiere un estado emocional ligeramente negativo
2018-Es-01944;@DebRyanShow @AlexXxStrecci #Rayito  jajajajaj siempre estar vestido así será algo bastante gracioso;valence;2;se infiere un estado emocional moderadamente positivo
2018-Es-01942;estoy bien feliz pero bien triste a la vez por qué ya casi termino mi serie :( es como que siiiii😬 pero noooooo 😢;valence;0;se infiere un estado emocional neutral or mixto
2018-Es-05607;En mi casa siempre se caen cosas y ;valence;-1;se infiere un estado emocional ligeramente negativo
2018-Es-00938;Por lo general no critico ese tipo de cosas, pero... Wtf la gente rumbeando hoy? Como si mañana fuese un día festivo;valence;-2;se infiere un estado emocional moderadamente negativo
2018-Es-02137;Mañana festivo y yo, pues si, yo trabajo todo él día😪🙁;valence;-3;se infiere un estado emocional muy negativo
2018-Es-02673;T paso alguna vez?Vi x la puerta d la pieza pasar a alguien x el pasillo. Miro y no hay nadie.  #raro #tepaso   #espanto ;valence;-1;se infiere un estado emocional ligeramente negativo
2018-Es-04785;@DonNahueI Nooo tío que el malo era Guardiola #Ironia;valence;-1;se infiere un estado emocional ligeramente negativo
2018-Es-02590;"Mi momento favorito de Cirque Du Soleil fue cuando se escuchó un hermoso ""@sebastianpinera conshetumare"" seguido de aplausos.";valence;1;se infiere un estado emocional ligeramente positivo
2018-Es-05753;@ClaudiaLopez 😒 wow! Alguien debía descubrirlo #sarcasmo;valence;-1;se infiere un estado emocional ligeramente negativo
2018-Es-03364;Michell me marcó para decirme que me tiene una sorpresa, que lleva 3 meses planeándola y me la dará en mi cumple ESO NO SE HACEE;valence;0;se infiere un estado emocional neutral or mixto
2018-Es-05138;@ESTEFANIAAMARIL @ccemx @LosImpacientes 😱 ¡Padrísimo! La vamos a pasar de lo mejor ya verás ☺️🙈 ¡Feliz cumple adelantado! 😘;valence;3;se infiere un estado emocional muy positivo
2018-Es-01101;Me alejé aunque no quería, pero te quería. #Ironía;valence;-1;se infiere un estado emocional ligeramente negativo
2018-Es-06490;@DanielaBlume ayer vi la fiesta Argentina en Gh, probaste el mate amargo bien argentino? Tienes que aprender a tomarlo para el desayuno😄;valence;1;se infiere un estado emocional ligeramente positivo
2018-Es-01745;"@_HijaDeMiMadre Ahhh jajaj leí ""yo quería dormir hoy"" ";valence;0;se infiere un estado emocional neutral or mixto
2018-Es-06302;Yo amo el grupo ;valence;2;se infiere un estado emocional moderadamente positivo
2018-Es-05746;@ConElMazoDando #TeLoDijeLaConstituyenteSiVa UN GUARDIA HERIDO DE GRAVEDAD EN LECHERIA Y NINGUN PARIODICO LO PUBLICA!! TERRORISMO!!;valence;-3;se infiere un estado emocional muy negativo
2018-Es-01947;me siento super miserable ahorita porque soy una seria amargada de mierda pero tengo comida :);valence;-2;se infiere un estado emocional moderadamente negativo
2018-Es-03428;No puedo creer lo de chester, estoy deprimido;valence;-3;se infiere un estado emocional muy negativo
2018-Es-04661;cuando me preguntan por qué tal persona es mi idol, simplemente le respondo porque me hace sonreír cuando estoy hecha mierda y es verdad lpm;valence;0;se infiere un estado emocional neutral or mixto
2018-Es-03828;este momentazo para entrar en el #felizlunes 😀 #quetengasunbuendia  rt el ajedrez me enseñó que con un mal movimiento puedes perder a tu;valence;1;se infiere un estado emocional ligeramente positivo
2018-Es-03759;Estaba animado a hacer algo k no es usual en la mua pero este dia se fue del qlo >:v;valence;-1;se infiere un estado emocional ligeramente negativo
2018-Es-04508;Así con razón se me cae tanto el pelo con tanto disgusto que me dan estos hijos de puta.;valence;-3;se infiere un estado emocional muy negativo
2018-Es-01844;Nací con el viejo Linkin Park, y a pesar de que ya no era partídiario de su nuevo sonido, siempre los admiré como banda.   Descansa (1/2);valence;0;se infiere un estado emocional neutral or mixto
2018-Es-02043;Déjame sobrepasar tus zonas de peligro hasta provocar tus gritos, y que olvides tu apellido;valence;1;se infiere un estado emocional ligeramente positivo
2018-Es-03400;Ama ver mis fotos 😂😂 no me enojo si me seguis amor ❤;valence;3;se infiere un estado emocional muy positivo
2018-Es-00626;Soy hambre 24/7 ;valence;-1;se infiere un estado emocional ligeramente negativo
2018-Es-00948;@xvzla2009 @noelleal No le quitemos sus méritos, no seamos mezquinos!! 😆;valence;1;se infiere un estado emocional ligeramente positivo
2018-Es-03052;El mejor fin de semana ;valence;3;se infiere un estado emocional muy positivo
2018-Es-06468;Andaría necesitando masajes ;valence;0;se infiere un estado emocional neutral or mixto
2018-Es-03251;Se me antoja una tostada de ceviche, nomás poe el puro berrinche.;valence;0;se infiere un estado emocional neutral or mixto
2018-Es-00492;@guiseverino4 Cala boca 😡;valence;-2;se infiere un estado emocional moderadamente negativo
2018-Es-03160;"Pon a cantar rancheras a Vicente Fernández y José José. Uno no domina el género, sería 1 encuentro ridículo. Lo mismo pienso de esta ""pelea""";valence;-1;se infiere un estado emocional ligeramente negativo
2018-Es-04623;Al pedo pongo alarma si la apago y sigo durmiendo 💁;valence;0;se infiere un estado emocional neutral or mixto
2018-Es-04895;@Angelcuentatwit ¿¿?? pero desde cuándo en España las Fuerzas del Orden cargan contra ciudadanos libres?? #ironía on;valence;-2;se infiere un estado emocional moderadamente negativo
2018-Es-03206;Porque me gustan los judíos porque ;valence;0;se infiere un estado emocional neutral or mixto
2018-Es-01499;Si la tristeza y el dolor continuarán mientras siga viviendo, ¿pero es normal? Yo quiero vivir con ese dolor. #feliz #lunes #felizlunes;valence;-1;se infiere un estado emocional ligeramente negativo
2018-Es-02848;@IvanSalum2 Yo también,  pero sigo un poco enojada;valence;-2;se infiere un estado emocional moderadamente negativo
2018-Es-00071;Cuando estes cansada de su inmadurez, aquí te esperaré...;valence;-2;se infiere un estado emocional moderadamente negativo
2018-Es-06945;@juancatab En serio!??;valence;0;se infiere un estado emocional neutral or mixto
2018-Es-03904;El sábado andaba como pico y las pibas de tango me trataron re bien, re cariñosas. Parece que tengo que andar así, para que me traten bien ;valence;0;se infiere un estado emocional neutral or mixto
2018-Es-02533;Por gusto y no por gustar, nunca para demostrar, siempre para sumar 6/6  #AhoraoNunca #ControversialTonyFlow #CosaNostra #comingsoon;valence;0;se infiere un estado emocional neutral or mixto
2018-Es-04322;No Lo Saben Pero esa chica me está gustando demasiado... Aún sabiendo que jamás pasará algo... 😢;valence;-2;se infiere un estado emocional moderadamente negativo
2018-Es-01643;"@aliciaenp Ajajjaa somos del clan twitteras perdidas pa eventos ""importantes"" ";valence;0;se infiere un estado emocional neutral or mixto
2018-Es-02916;Como dos Ángeles torturados por un implacable placer En el cristal azul del amanecer Sigamos tras el espejismo.  Baudelaire;valence;-1;se infiere un estado emocional ligeramente negativo
2018-Es-00030;@ItzelBarajaas Te sigo de hace tiempo, y hoy tuve la fortuna de verte en el estadio, quise hablarte pero me dio pena😂🔴⚪;valence;1;se infiere un estado emocional ligeramente positivo
2018-Es-00020;"Ya comienza a darme hambre; esa es buena señal ";valence;1;se infiere un estado emocional ligeramente positivo
2018-Es-00937;@laufer4 @balfederico Muero x saber q pasó hoy en la sentencia.  Muero x saber q pasará mañana en LAM #miedo;valence;0;se infiere un estado emocional neutral or mixto
2018-Es-03589;Terrible juego el Half-Life;valence;-3;se infiere un estado emocional muy negativo
2018-Es-03537;"@avilesmgl Yo tenia años sin ir, me gusto volver; hay agua, no como hace años. Descansa ";valence;1;se infiere un estado emocional ligeramente positivo
2018-Es-05904;@AndresF_Garcia Todos los dibujos tienen cachos, sospechoso @josesalaaas @Dederlealdair @I_amghoul @JhonCruz0525 @jhonatanperez__;valence;0;se infiere un estado emocional neutral or mixto
2018-Es-00782;Arrepiéntete pescador ;valence;-1;se infiere un estado emocional ligeramente negativo
2018-Es-01269;Cuando veo una foto de ella sonriendo, me hace sonreír como idiota.;valence;2;se infiere un estado emocional moderadamente positivo
2018-Es-02242;@olvihormigos Pues nada, el CM a la calle. Más de uno sabría hacerlo mejor sin ofender a nadie;valence;-2;se infiere un estado emocional moderadamente negativo
2018-Es-00654;Te aprecio mucho, aunque me jodas hasta el punto del cansancio con el casamiento(?;valence;0;se infiere un estado emocional neutral or mixto
2018-Es-04165;Me gustaría tomarte en serio, pero hacerlo seria ofender tu inteligencia.;valence;-3;se infiere un estado emocional muy negativo
2018-Es-06744;@perrusky @Carlarendon @jvillalpandoc No dones perrus, neta ni una vez te hemos pedido eso ;valence;-1;se infiere un estado emocional ligeramente negativo
