ID;Tweet;Dimension;Intensity;Description
2018-Es-04815;El viernes se viene el frío con lluvia. Ya era necesario, ese clima me pone de buenas y cero amargado. 😀;valence;2;se infiere un estado emocional moderadamente positivo
2018-Es-03495;No consigo recordar si era en #Barcelona donde tuvieron que poner cámaras para evitar violencia desproporcionada de los Mossos #Ironía;valence;-2;se infiere un estado emocional moderadamente negativo
2018-Es-06771;Nunca me a gustado ser amargado;valence;-2;se infiere un estado emocional moderadamente negativo
2018-Es-01519;Y yo pensé q una estrella fugaz era una estrella muy bonita q tenía miedo de brillar, y huir lo más lejos posible. Un poco como tú, como yo.;valence;1;se infiere un estado emocional ligeramente positivo
2018-Es-01330;@mariobautista_ Ya me imagino la carita de felicidad de estrellita al verte ❤️ eres una persona increíble nunca cambies ❤️;valence;2;se infiere un estado emocional moderadamente positivo
2018-Es-05484;@laresolana ya quiero que empiece!!! Y mañana no me podré levantar ;valence;0;se infiere un estado emocional neutral or mixto
2018-Es-01465;@yosoylopeor Pusiste azucar amargo?;valence;-1;se infiere un estado emocional ligeramente negativo
2018-Es-06236;@manuelrosalesg Verdad ? Te creemos ? Tu huiste como lo q eres un traidor y cobarde, después negociaste tu salida con esas ratas del  Psuv;valence;-2;se infiere un estado emocional moderadamente negativo
2018-Es-05762;Por ser Familiar de un corrupto, ladrón y asesino del gobierno, tengo que jalarle bolas y defenderlo? Eso si es Tener dignidad! #sarcasmo;valence;-3;se infiere un estado emocional muy negativo
2018-Es-06620;@RamaPorchietti Feliz día amigo. Tkm;valence;3;se infiere un estado emocional muy positivo
2018-Es-02765;Le estaba por mandar un msj y me acordé que estaba enojada;valence;-2;se infiere un estado emocional moderadamente negativo
2018-Es-03862;Y dale con el #miedo ! Que no! Que es cosa de #amor !!!! #Cristovive;valence;0;se infiere un estado emocional neutral or mixto
2018-Es-00454;daa en serio se van a poner a subir fotos con todos sus amigos? es más divertido ver un documental de como crece el pasto;valence;-1;se infiere un estado emocional ligeramente negativo
2018-Es-03284;Que bronca cuando te hablan pero despues no te responden! 😡;valence;-3;se infiere un estado emocional muy negativo
2018-Es-06686;@cordobatami15 @cande_meirinio Jajajaja atr ;valence;1;se infiere un estado emocional ligeramente positivo
2018-Es-03003;@mauqxeen 300€ environ ;valence;0;se infiere un estado emocional neutral or mixto
2018-Es-05490;@ObservadBinario Es preferible salir por Cúcuta. Por Maicao es demasiado peligroso;valence;-1;se infiere un estado emocional ligeramente negativo
2018-Es-03881;3.1415. No pero sí me caes bien ;valence;-1;se infiere un estado emocional ligeramente negativo
2018-Es-01946;Es muy democrático increpar, señalar e insultar a quien no piensa como tú. #3Oct #Ironía;valence;-3;se infiere un estado emocional muy negativo
2018-Es-02317;@sophiareyest Asi son las Zorras ... 😂;valence;0;se infiere un estado emocional neutral or mixto
2018-Es-03783;Es normal que me sienta tan emocionado🙈;valence;1;se infiere un estado emocional ligeramente positivo
2018-Es-00284;@JPAlvarezGuedea @clubleonfc @VivoEnLeon @LeonesEsmeralda @fitopons3 QUE HORROR DE PLAYERAS!;valence;-2;se infiere un estado emocional moderadamente negativo
2018-Es-02068;@CheFulana Sale un pati rabioso?  Ajaja;valence;0;se infiere un estado emocional neutral or mixto
2018-Es-06369;@PaoDEdwards Te aviso pues, lo más probable que un viernes de 4-6 ;valence;0;se infiere un estado emocional neutral or mixto
2018-Es-00317;@FlorRatisconi Si la alegría es eso. :(;valence;-1;se infiere un estado emocional ligeramente negativo
2018-Es-02565;Ya puse mis mejores canciones para esta etapa de enojo pasarla bien chingona;valence;-1;se infiere un estado emocional ligeramente negativo
2018-Es-02951;❤️✌🏾Ya somos 400 Seguidoresss✌🏾❤️ #gracias #Feliz #FelizLunes #LunesDeGanarSeguidores #SIGUEMEYTESIGO #SiguemeYTeSigoDeVuelta #Rt;valence;3;se infiere un estado emocional muy positivo
2018-Es-02275;@DebRyanShow no sé si me debería de dar pena o alegría de que ha sido de puro #Rayito;valence;-1;se infiere un estado emocional ligeramente negativo
2018-Es-01314;es que archie colega sólo tienes músculos y judhead mira en serio ojalá te hubieran matado a ti y no a jason;valence;-1;se infiere un estado emocional ligeramente negativo
2018-Es-00373;Con esos ojos, esa boca, la manera de caminar. Además, no es tu peo. Eso es lo que pienso, y en realidad hago tipo 😊;valence;0;se infiere un estado emocional neutral or mixto
2018-Es-05225;@allisonlopez_ @aramirodriguez @rociomeza_ Ah ya, nosotros fuimos su diversión y ahora quieren salir sin nosotros? Ok Marta;valence;0;se infiere un estado emocional neutral or mixto
2018-Es-04939;-Su mochihermano es consumido por la oscuridad.-;valence;-2;se infiere un estado emocional moderadamente negativo
2018-Es-03922;@ydiehfuentes Ya porque saliste el fds ;valence;0;se infiere un estado emocional neutral or mixto
2018-Es-05886;No me convenció nadie, me convenció tu sonrisa 🎵;valence;2;se infiere un estado emocional moderadamente positivo
2018-Es-04560;"La definición de #Trump sobre Puerto Rico: ""Es una #isla rodeada de agua"".Bueno este día aprendí algo.(#sarcástica) #Tampico #mty";valence;-1;se infiere un estado emocional ligeramente negativo
2018-Es-04719;@KevenYHensy Yo que no soy su madre solo su fans estoy tan orgullosa de tener unos ídolos tan talentosos!!😍😍;valence;3;se infiere un estado emocional muy positivo
2018-Es-04958;@MundoQuemero habia una cancion que decia  HAY VIENE EL NEGRO RAMON BAILANDO ALEGRE EL BAYON;valence;1;se infiere un estado emocional ligeramente positivo
2018-Es-01831;@andrizek @EuclidesFla JAIR VENTURA!!!;valence;0;se infiere un estado emocional neutral or mixto
2018-Es-06506;@burgerqueenn_ @A3Noticias Solo entrada/salida? Y en el recreo y en el WC, en las pausas,al atar las zapatillas en clase de deporte. #Ironia;valence;-2;se infiere un estado emocional moderadamente negativo
2018-Es-02707;Me acordé de una foto, me puse a buscarla, vi todo el álbum y boom. Nostalgia.;valence;-1;se infiere un estado emocional ligeramente negativo
2018-Es-00558;Creas una dependencia de la verga por que extrañas a cierta persona, sus labios, su sonrisa, la luz de su mirada, sus caricias, sus chistes.;valence;0;se infiere un estado emocional neutral or mixto
2018-Es-04715;Increíble la cantidad de pelotudeces que hablamos con esta mina ;valence;-1;se infiere un estado emocional ligeramente negativo
2018-Es-03167;Terrible día y lo que falta...;valence;-3;se infiere un estado emocional muy negativo
2018-Es-02030;Fuera de joda que me siento afortunada por tener a las personas que tengo;valence;3;se infiere un estado emocional muy positivo
2018-Es-04911;@adosvoces_tn jaja que genial bonelli y compañia, ahora creen en encuestas? Gano Vidal 😳 Gano Trump 😳 y dijeron q no servian! #PocaMemoria;valence;2;se infiere un estado emocional moderadamente positivo
2018-Es-01982;Pa es una pesadilla;valence;-2;se infiere un estado emocional moderadamente negativo
2018-Es-06509;Buena cuenta @PerdidosEncont , recién la descubrí y lo q hacen es genial. Dueños q encuentran a sus mascotas,y abandonados q encuentran casa;valence;1;se infiere un estado emocional ligeramente positivo
2018-Es-03681;✴Feliz Día ✴  para quienes se considera un amigo..;valence;1;se infiere un estado emocional ligeramente positivo
2018-Es-00195;@vicky_rayada Nambre como crees? Sabes mucho más que los que se dicen periodistas👉 (Víctor Hdz)👈 ;valence;0;se infiere un estado emocional neutral or mixto
2018-Es-05404;Una locura, baila orgulloso, hoy se presenta este corazón alegre y caprichoso;valence;2;se infiere un estado emocional moderadamente positivo
2018-Es-02958;Que dicha que mañana no tengo clases .😛;valence;3;se infiere un estado emocional muy positivo
2018-Es-06141;@Jseute Las mejores personas llegan sin buscarlas.  😄;valence;3;se infiere un estado emocional muy positivo
2018-Es-01182;@JonaaJuarez Ya veo que estás re cagado de hambre porque te comiste la h jajajajajaja  ;valence;2;se infiere un estado emocional moderadamente positivo
2018-Es-00427;Mi amiga habla sola dormida, es más estamos teniendo una conversación...... ;valence;0;se infiere un estado emocional neutral or mixto
2018-Es-01021;@0scarChavez @Reforma Que horror!!, las redes son chismógrafos #sarcasmo , así se han construído es su eje;valence;-2;se infiere un estado emocional moderadamente negativo
2018-Es-05992;@omar_ADG Lo sé, soy brillante.;valence;1;se infiere un estado emocional ligeramente positivo
2018-Es-05998;@fiooresilva Fuera de joda si vi a tu hermana, vos sos la unica amargada que no sale nunca!!;valence;-3;se infiere un estado emocional muy negativo
2018-Es-03871;@MARTUVERA2 Jajajajajaja desde ese lunes 😅;valence;2;se infiere un estado emocional moderadamente positivo
2018-Es-05214;@loveslywatson omg me paso lo mismo la otra vez, tremendo moretón en él culo me hice;valence;-2;se infiere un estado emocional moderadamente negativo
2018-Es-00225;Siempre que veo películas en netflix con alguien elijo una que ya vi o que parezca aburrida porque sé que no la voy a ver 🔥👀;valence;0;se infiere un estado emocional neutral or mixto
2018-Es-06758;Sé que soy capaz de mucho, pero la poca confianza en mí me juega una mala pasada y me hace volar bajo...;valence;-2;se infiere un estado emocional moderadamente negativo
2018-Es-04962;Trepate encima de este bicho y yo te lo meto hasta enloquecer;valence;0;se infiere un estado emocional neutral or mixto
2018-Es-06116;Me siento muy orgullosa de lo que he logrado;valence;3;se infiere un estado emocional muy positivo
2018-Es-03703;Hablamos, sos copadisimo jajajajaja igual sos re estupido bue, mentira feo ;valence;0;se infiere un estado emocional neutral or mixto
2018-Es-02806;@PonePrimera870 @RominaDelPla @romanlejtman16 Resentida. Hacerte tratar. Pobres alumnos. Los gestos educan y el tuyo es violento;valence;-3;se infiere un estado emocional muy negativo
2018-Es-02178;Esta vuelta a Capital tiene gustito a que el 5 vuelvo 😊;valence;3;se infiere un estado emocional muy positivo
2018-Es-01338;Check list: Boleta de @BrunoMars: ✅😍 Viaje de playa: ✅😍💜 #Felicidad;valence;3;se infiere un estado emocional muy positivo
2018-Es-02386;@sanitas_atiende estoy muy disgustada por la gestión en mi póliza y me van pasando de un lado a otro. Decepcion Es la palabra;valence;-3;se infiere un estado emocional muy negativo
2018-Es-02236;Segunda vez que sueño con la misma persona, esto se está complicando ;valence;0;se infiere un estado emocional neutral or mixto
2018-Es-04546;Una clienta se estaba quejando del clima que sigue haciendo frio en primavera, pero ojo se enojo xq no le daba una bolsa con manija #Irónico;valence;-1;se infiere un estado emocional ligeramente negativo
2018-Es-00682;@BenjaVerdessi Es mi primera vez, me siento orgullosa :);valence;3;se infiere un estado emocional muy positivo
2018-Es-02830;@armandozhoil Cierto... ¡Disfrútalo! ;valence;2;se infiere un estado emocional moderadamente positivo
2018-Es-01085;#Felíz #Aniversario de #Amistad en #Facebook y que sean muchos más 📷🍸🍰💖💋💋💋;valence;2;se infiere un estado emocional moderadamente positivo
2018-Es-00327;hoy después de 39 semanas haré vida social estoy emocionado;valence;2;se infiere un estado emocional moderadamente positivo
2018-Es-06782;Juega conmigo lorena ah;valence;0;se infiere un estado emocional neutral or mixto
2018-Es-02200;「@Rodolphustty」 «momento entendió que quería batirse en duelo con ella. Frunció el ceño al ver sus gestos mirando al cielo apuntando con la»;valence;-1;se infiere un estado emocional ligeramente negativo
2018-Es-01878;Compartimos el gusto por los gatos y el odio por el llanto de los niños.;valence;-1;se infiere un estado emocional ligeramente negativo
2018-Es-02548;@RACCAR Claro, por eso Guilty Gear Xrd o Dragon Ball FighterZ son una caca... #Ironía;valence;-2;se infiere un estado emocional moderadamente negativo
2018-Es-00179;@Anndy5000 Esta Andy XD ;valence;0;se infiere un estado emocional neutral or mixto
2018-Es-04652;Siento que pasaron mi snap a algun grupo o algo pq me añadieron como 9 personas ;valence;0;se infiere un estado emocional neutral or mixto
2018-Es-02524;@Juliococo que crees que pase en los días venideros con todo esto del dichoso acuerdo? La desesperanza es agobiante;valence;-2;se infiere un estado emocional moderadamente negativo
2018-Es-03387;Tengo tremendo sueño;valence;-2;se infiere un estado emocional moderadamente negativo
2018-Es-00439;El mayor criminal del país diciéndole “delincuente” a nuestro vicepresidente constitucional!!!! #irónico #quemássepuedeesperardeesasbasura;valence;-2;se infiere un estado emocional moderadamente negativo
2018-Es-05315;@edusadeci es correcto, pero es ilegal… en cualquier país ;valence;0;se infiere un estado emocional neutral or mixto
2018-Es-04047;JAJAJAJAJAJAJAJA, admito que eso me dio risa, me lo imagine;valence;3;se infiere un estado emocional muy positivo
2018-Es-02464;Estoy llorando culpa de la alergia, quiero y a la vez no ir al médico;valence;-2;se infiere un estado emocional moderadamente negativo
2018-Es-03383;Tomando birras porque por un tiempo muy largo no voy a poder #Tristeza 😖🍺;valence;-3;se infiere un estado emocional muy negativo
2018-Es-03789;@AlfredoRamosM @CancilleriaCol Pobre víctima!!  No puede ser que injusticia tan atroz!! #sarcasmo;valence;-2;se infiere un estado emocional moderadamente negativo
2018-Es-02158;Acabo de ir rápido al súper y sorpresa me llevé al encontrarme con una sabrosa salsa macha de mi bello Veracruz ♥️☝🏾;valence;3;se infiere un estado emocional muy positivo
2018-Es-05117;Valentinaa mañana vamos al mc ? Yo pago 😟;valence;0;se infiere un estado emocional neutral or mixto
2018-Es-06487;Lo bacán de ser más patito feo que divina es que jamás vas a encontrar a alguien haciéndote pasar por ti. PUNTO A MI FAVOR ;valence;0;se infiere un estado emocional neutral or mixto
2018-Es-06873;Le daria un like al que dibujara a mi oc con vestido (esto no lo vera nadie mas que nicole, aunque me debería asustar un poco...);valence;-1;se infiere un estado emocional ligeramente negativo
2018-Es-04080;Me levanté c la idea de que habían quedado milanesas hechas y SE LAS COMIERON, indignada;valence;-2;se infiere un estado emocional moderadamente negativo
2018-Es-05977;La noche está bien, ahora, elevate hasta el cielo, hazme sonreír así para siempre.;valence;2;se infiere un estado emocional moderadamente positivo
2018-Es-04236;Se ve que es hiper difícil preguntar en lugar de que te llueva el cabreo de la otra persona y encima llamarle amargado. xD;valence;-2;se infiere un estado emocional moderadamente negativo
2018-Es-04803;@Danan_Zen Me lo dejaron de tarea en el catecismo... 😃;valence;1;se infiere un estado emocional ligeramente positivo
2018-Es-02894;Me acabo de comer mi último pedazo de pastel Red Velvet con una copa de vino #AdiosSemanaCumpleañera #HolaDetox ;valence;0;se infiere un estado emocional neutral or mixto
2018-Es-06902;#2MillonesDeMorrillos @heyitspriscila El sabado te vere hermosa,aqui en tijuana,estoy mega emocionada!!😍♥️;valence;3;se infiere un estado emocional muy positivo
2018-Es-02975;Cercano por así decirlo. Y debo decir que no esperaba que fuese así de terrible el padecer de anorexia. En verdad, me.alegro muchisimo+;valence;1;se infiere un estado emocional ligeramente positivo
2018-Es-05333;Neta ya cállense a la verga todos ;valence;-3;se infiere un estado emocional muy negativo
2018-Es-06627;Lo peor es que como solo te atienden por mail, no se hacen cargo!, la atención al cliente post venta es de #terror @DespegarAr;valence;-3;se infiere un estado emocional muy negativo
2018-Es-04876;"Feliz dia del amig... Ah no no tengo en la comunidad :""u";valence;1;se infiere un estado emocional ligeramente positivo
2018-Es-06529;Necesito salir en la oscuridad veo más claro que con dos soles, y es una porquería todo lo que se me atraviesa 😂;valence;-1;se infiere un estado emocional ligeramente negativo
2018-Es-06839;@AllDiscourages_ Por tu culpa me he acordado del crush y #tristeza;valence;-3;se infiere un estado emocional muy negativo
2018-Es-00366;Estoy segura de que en mi examen de hoy saqué 10 y estoy muy contenta, ya quiero hacer otro examen.🙈;valence;3;se infiere un estado emocional muy positivo
2018-Es-05059;Y si ya no me quiere? ;valence;-3;se infiere un estado emocional muy negativo
2018-Es-03650;@FireofRam @KekoMDZ JUSTO TE HE VISTO POR LA TL Y TE IBA A INSULTAR;valence;-3;se infiere un estado emocional muy negativo
2018-Es-01068;Ahora si a dormir.. Mañana temprano viene mi amiga! 😀;valence;2;se infiere un estado emocional moderadamente positivo
2018-Es-03132;@ahorapodemos @Irene_Montero_ Está rabioso porque va medio bien la cosa;valence;0;se infiere un estado emocional neutral or mixto
2018-Es-01887;@maryel_rc Como yo ;valence;0;se infiere un estado emocional neutral or mixto
2018-Es-00778;Policia abajo de mi casa con un tío #miedo;valence;-2;se infiere un estado emocional moderadamente negativo
2018-Es-05493;Pues si sos puta ya pue pero no te enojes por que te digan lo que sos ;valence;-3;se infiere un estado emocional muy negativo
2018-Es-04660;@FernandoAgustin Lesionado el Tucu?...adiós mundial 👋#ironía;valence;-1;se infiere un estado emocional ligeramente negativo
2018-Es-01649;Estuve todo el día dibujando y me duele mucho todo. Vale.  Estoy ansiosa y tenía que hacer algo.;valence;-1;se infiere un estado emocional ligeramente negativo
2018-Es-04720;Que nervioso me hizo poner hoy la vieja esa en la escuela jajajajaja;valence;-1;se infiere un estado emocional ligeramente negativo
2018-Es-06671;@BBarbip Jajajajajajaja no puedo, es de confidencialidad eso ;valence;2;se infiere un estado emocional moderadamente positivo
2018-Es-02653;Ella dijo que me enviaría a un colegio por meses y por un lado me alegre;valence;0;se infiere un estado emocional neutral or mixto
2018-Es-03647;@CKalher_ - Le espera en la puerta, frunciendo el ceño porque no tiene muy buen aspecto.-;valence;-1;se infiere un estado emocional ligeramente negativo
2018-Es-01964;@Sinner_Silas —La joven bruja le dedicó una mirada de soslayo por encima de su hombro y arrugó la nariz con disgusto.—  Te recuerdo que,»;valence;0;se infiere un estado emocional neutral or mixto
2018-Es-04915;En España, se vive bien..!!. No nos podemos quejar. #leyMordaza #ironía;valence;0;se infiere un estado emocional neutral or mixto
2018-Es-04309;@Aransafelix Jajajaj ya deja de citar nuestros tweets ;valence;0;se infiere un estado emocional neutral or mixto
2018-Es-04193;Horas antes de un final mi cerebro no tiene mejor idea que tener un colapso nervioso por cosas que nada que ver 😩😩😩;valence;-1;se infiere un estado emocional ligeramente negativo
2018-Es-06552;Un beso es un agradable recordatorio de que dos cabezas son mejores que una.;valence;2;se infiere un estado emocional moderadamente positivo
2018-Es-04762;@MeliAyelen_ Ma te vale igual estoy #enojada chau;valence;-3;se infiere un estado emocional muy negativo
2018-Es-06857;@crlsmrt Es Nicaragua pero también pasa por Cartago ;valence;0;se infiere un estado emocional neutral or mixto
2018-Es-03308;@aonrec Unos cuantos cortes nada mas en esa linea de tiempo mas capas de ajuste unas 2 nada mas #Sarcasmo;valence;-1;se infiere un estado emocional ligeramente negativo
2018-Es-00349;¡FELIZ 20 DE JULIO!;valence;3;se infiere un estado emocional muy positivo
2018-Es-00021;Estoy muy contento 😋😋😋 #FelizLunes #LunesDeGanarSeguidores #Contento #25Sep;valence;3;se infiere un estado emocional muy positivo
2018-Es-04529;@counterrevolnst @rntannus @marcusv_prado @fcjffcjf @RBadeluk @alefrotabrasil O Nazismo era esquerda. #irônica;valence;0;se infiere un estado emocional neutral or mixto
2018-Es-01553;Con la suerte que tengo, muy probablemente voy a reencarnar en mi mismo!!! 😂 #Sarcásmo;valence;2;se infiere un estado emocional moderadamente positivo
2018-Es-02874;¡Feliz cumpleaños, mi alto guapo moreno inteligente! 😘;valence;3;se infiere un estado emocional muy positivo
2018-Es-06486;@PPTeamKaren @PPTeamRafa @PPTeamLesslie @Bryan_SKabeche @Eddy_SKabeche las 5 personas mas importantes en mi vida ;valence;0;se infiere un estado emocional neutral or mixto
2018-Es-05270;Les juro que los teragrip ultra cachuos del horror forte noche siguen sabiendo a agua sucia.;valence;-2;se infiere un estado emocional moderadamente negativo
2018-Es-04182;Llevarle comida a tu novio y verle esa carita de felicidad 🙈❤️;valence;2;se infiere un estado emocional moderadamente positivo
2018-Es-01719;Madre mía! El doble de Manuel Bartual saliendo en las TVs. ;valence;1;se infiere un estado emocional ligeramente positivo
2018-Es-06002;aMARgado ayer tarde por nadar a la mañana,hoy en la mañana agujas en el brazo entraron a despertar las Olas  fluyen dentro del ohmbrito;valence;-2;se infiere un estado emocional moderadamente negativo
2018-Es-00677;Gracias WINSTON por traer tanto entretenimiento a nuestras pantallas por eso y más 🇻🇪 ✊❤️ #SomosTVES;valence;2;se infiere un estado emocional moderadamente positivo
2018-Es-03304;@o_solorzano78 @tinunjei @javi1dc Estaba siguiendo el debate y ví que al final te quedaste solo, igual que tu partido. Chao ;valence;-2;se infiere un estado emocional moderadamente negativo
2018-Es-02961;@miishelv20 Me hackearon! 😢;valence;-3;se infiere un estado emocional muy negativo
2018-Es-01320;Oye @PcSegob hay momentos, de la nada, que mi corazoncito late rápid, no puedo respirar y siento que todo vibra 😭 Qué se hace? #mexico;valence;-1;se infiere un estado emocional ligeramente negativo
2018-Es-05630;@Paulina0338 Eh we a quien le escribes tanto mensaje se ve mucho risa xd;valence;0;se infiere un estado emocional neutral or mixto
2018-Es-06788;Cuando escucho a Naranjito la ira se apodera de mí. Al final tendré que ignorarlo completamente. Mi salud es lo primero.;valence;-3;se infiere un estado emocional muy negativo
2018-Es-02149;@softestangcl No me enojo, es una expresión :( me refería a molestarlo un poco. Gerardito jajaj qué lindos podo(?;valence;-1;se infiere un estado emocional ligeramente negativo
2018-Es-01492;@randymeeks Ay que pena la gente desinformada... Díselo hombre, díselo... Díselo de mis partes!! XDD #Ironía #HumorTesticular;valence;-1;se infiere un estado emocional ligeramente negativo
2018-Es-01154;Es chistoso cuando tienes una conversación corta con alguien y te alegra totalmente el día.;valence;3;se infiere un estado emocional muy positivo
2018-Es-00261;No hay nada mas peligroso qué una mujer herida #LaNocturna;valence;-2;se infiere un estado emocional moderadamente negativo
2018-Es-03635;Estoy hirviendo de la arrechera;valence;-2;se infiere un estado emocional moderadamente negativo
2018-Es-06913;@jbryan_x Fui a verla el año pasado y tuvo su toque divertido pero esperaba más, ya veremos cómo va esta 😃;valence;0;se infiere un estado emocional neutral or mixto
2018-Es-02440;Qué sorpresa, no puedo dormir. ☺;valence;0;se infiere un estado emocional neutral or mixto
2018-Es-06941;Mi bien ponderada @piCkOL, ¡feliz cumpleaños! Me tomo tres cervezas a tu salud. Abrazo grande pa' ti.;valence;3;se infiere un estado emocional muy positivo
2018-Es-02522;@DimeMemo @Resentimiento voss con el palo selfie jajajajaja @c0tiii;valence;1;se infiere un estado emocional ligeramente positivo
2018-Es-03217;@PauDybala_JR @douglascosta Tremenda dupla se viene 😍 @juniorarias92;valence;1;se infiere un estado emocional ligeramente positivo
2018-Es-01000;@Anxi_us Te llevaría, pero está a punto de llover y me da miedo el ambiente eléctrico y me dan paja los mosquitos;valence;-2;se infiere un estado emocional moderadamente negativo
2018-Es-04405;Recién @jlespert recordó que la última vez que vistió a ML fue en noviembre de 2001 ;valence;0;se infiere un estado emocional neutral or mixto
2018-Es-02131;Acá bien alegre con mi laboratorio de mate pa' mañana;valence;2;se infiere un estado emocional moderadamente positivo
2018-Es-04654;Ya arranco el vientito ... que dia nos espera ... #miedo ! 🙈🙉;valence;-2;se infiere un estado emocional moderadamente negativo
2018-Es-00795;Para tristeza y felicidad, Ed Sheeran al rescate.🙃;valence;0;se infiere un estado emocional neutral or mixto
2018-Es-00967;@_DAVE_fs No, sigue siendo una pesadilla..;valence;-2;se infiere un estado emocional moderadamente negativo
2018-Es-04072;Qué grata sorpresa ha sido Merida;valence;3;se infiere un estado emocional muy positivo
2018-Es-05681;Quien me manda a ser tan cabeza duraaaa;valence;-2;se infiere un estado emocional moderadamente negativo
2018-Es-03236;mi gasista de burzaco en el 2015 ponia 55 estufas hoy 3 ... ya esta, es la medida de un laburante- este sistema es deplorable;valence;-2;se infiere un estado emocional moderadamente negativo
2018-Es-01396;Hoy me tome el caffè mocha mas amargo de mi vida.;valence;-1;se infiere un estado emocional ligeramente negativo
2018-Es-02552;Esta boluda de la vidal me aparece en todos los anuncios de youtube 😠😠😠😠;valence;-3;se infiere un estado emocional muy negativo
2018-Es-04104;¡Feliz día a todos los que saben que son mis amigos! (Responde este tweet, si le doy fav eres uno de ellos :D);valence;3;se infiere un estado emocional muy positivo
2018-Es-01317;@DebRyanShow @TecnopolisNC #rayito te irá genial;valence;1;se infiere un estado emocional ligeramente positivo
